puesto,titulo,año,puntuacion,votos,duracion_horas,directores,escritores,generos
1260,Hamlet,1996,7.7,40928,4.03,Kenneth Branagh,"William Shakespeare, Kenneth Branagh",Drama
1261,The Muppet Movie,1979,7.6,40897,1.58,James Frawley,"Jerry Juhl, Jack Burns","Adventure, Comedy, Family"
1262,Taste of Cherry,1997,7.7,39697,1.58,Abbas Kiarostami,Abbas Kiarostami,Drama
1263,Fantastic Planet,1973,7.7,39532,1.2,René Laloux,"Stefan Wul, Roland Topor, René Laloux","Animation, Sci-Fi"
1264,A Man for All Seasons,1966,7.7,38589,2.0,Fred Zinnemann,Robert Bolt,"Biography, Drama, History"
1265,After the Wedding,2006,7.7,38327,2.0,Susanne Bier,"Susanne Bier, Anders Thomas Jensen",Drama
1266,Hedwig and the Angry Inch,2001,7.7,38261,1.58,John Cameron Mitchell,"John Cameron Mitchell, Stephen Trask","Comedy, Drama, Music"
1267,Red River,1948,7.7,36207,2.22,"Howard Hawks, Arthur Rosson","Borden Chase, Charles Schnee","Drama, Western"
1268,Joint Security Area,2000,7.7,36185,1.83,Park Chan-wook,"Park Chan-wook, Kim Hyun-seok, Seong-san Jeong, Mu-yeong Lee, Park Myeong-chan, Sang-yeon Park","Action, Drama, Thriller"
1269,Happy Together,1997,7.7,36110,1.6,Wong Kar-Wai,"Wong Kar-Wai, Manuel Puig","Drama, Romance"
1270,L'Avventura,1960,7.7,35243,2.4,Michelangelo Antonioni,"Michelangelo Antonioni, Elio Bartolini, Tonino Guerra","Drama, Mystery, Romance"
1271,Wait Until Dark,1967,7.7,35111,1.8,Terence Young,"Frederick Knott, Robert Carrington, Jane-Howard Hammerstein",Thriller
1272,Raazi,2018,7.7,34863,2.3,Meghna Gulzar,"Harinder S. Sikka, Meghna Gulzar, Bhavani Iyer","Action, Drama, Thriller"
1273,The Edge of Heaven,2007,7.7,34676,1.93,Fatih Akin,Fatih Akin,Drama
1274,The Innocents,1961,7.7,34503,1.67,Jack Clayton,"Henry James, John Mortimer, William Archibald, Truman Capote","Drama, Horror, Mystery"
1275,Millennium Actress,2001,7.8,34353,1.45,"Satoshi Kon, Kô Matsuo","Satoshi Kon, Sadayuki Murai","Animation, Drama, Fantasy"
1276,Dragon Ball Super: Broly,2018,7.7,34328,1.67,Tatsuya Nagamine,Akira Toriyama,"Action, Adventure, Animation"
1277,Fireworks,1997,7.7,34318,1.72,Takeshi Kitano,Takeshi Kitano,"Crime, Drama, Romance"
1278,Chandu Champion,2024,7.8,33800,2.37,Kabir Khan,"Sumit Arora, Kabir Khan, Sudipto Sarkar, Rohit Shukre","Action, Biography, Drama"
1279,Minnal Murali,2021,7.8,33635,2.63,Basil Joseph,"Arun Anirudhan, Justin Mathew","Action, Comedy, Drama"
1280,Hindi Medium,2017,7.8,33559,2.2,Saket Chaudhary,"Sonu Sinha, Neeraj Singh, Saket Chaudhary, Abdul Rafay Chandio, Amitosh Nagpal, Zeenat Lakhani","Comedy, Drama"
1281,Cape Fear,1962,7.7,33200,1.77,J. Lee Thompson,"John D. MacDonald, James R. Webb","Drama, Thriller"
1282,Udta Punjab,2016,7.7,33153,2.47,Abhishek Chaubey,"Sudip Sharma, Abhishek Chaubey","Crime, Drama"
1283,The Umbrellas of Cherbourg,1964,7.8,33089,1.52,Jacques Demy,Jacques Demy,"Drama, Musical, Romance"
1284,Badla,2019,7.7,32247,1.97,Sujoy Ghosh,"Oriol Paulo, Sujoy Ghosh, Raj Vasant","Crime, Drama, Mystery"
1285,The Promised Land,2023,7.7,32172,2.12,Nikolaj Arcel,"Nikolaj Arcel, Anders Thomas Jensen, Ida Jessen","Action, Biography, Drama"
1286,14 Peaks: Nothing Is Impossible,2021,7.7,31899,1.68,Torquil Jones,"Gabriel Clarke, Torquil Jones","Adventure, Documentary, Sport"
1287,Scarface,1932,7.7,31836,1.55,"Howard Hawks, Richard Rosson","Armitage Trail, Ben Hecht, Seton I. Miller, John Lee Mahin, W.R. Burnett, Howard Hawks, Fred Pasley","Action, Crime, Drama"
1288,Navalny,2022,7.7,31540,1.65,Daniel Roher,,"Biography, Documentary"
1289,The Asphalt Jungle,1950,7.8,31473,1.87,John Huston,"Ben Maddow, John Huston, W.R. Burnett","Crime, Drama, Film-Noir"
1290,The Caine Mutiny,1954,7.7,31191,2.07,Edward Dmytryk,"Stanley Roberts, Michael Blankfort, Herman Wouk","Drama, War"
1291,My Life as a Zucchini,2016,7.8,31156,1.17,Claude Barras,"Céline Sciamma, Claude Barras, Morgan Navarro, Germano Zullo, Gilles Paris, Christian La Monte, Michael Sinterniklaas","Animation, Comedy, Drama"
1292,Secret Superstar,2017,7.8,30905,2.5,Advait Chandan,Advait Chandan,"Drama, Music"
1293,Dreams,1990,7.7,30832,1.98,"Akira Kurosawa, Ishirô Honda","Akira Kurosawa, Ishirô Honda","Drama, Fantasy"
1294,The Dissident,2020,7.8,30819,1.98,Bryan Fogel,"Mark Monroe, Bryan Fogel","Crime, Documentary, Thriller"
1295,Sorcerer,1977,7.7,30729,2.02,William Friedkin,"Walon Green, Georges Arnaud, William Friedkin","Adventure, Drama, Thriller"
1296,"Like Father, Like Son",2013,7.8,29594,2.02,Hirokazu Koreeda,Hirokazu Koreeda,Drama
1297,Black Narcissus,1947,7.7,29512,1.68,"Michael Powell, Emeric Pressburger","Rumer Godden, Michael Powell, Emeric Pressburger",Drama
1298,The Breadwinner,2017,7.7,29437,1.57,Nora Twomey,"Anita Doron, Deborah Ellis","Animation, Drama, Family"
1299,Cléo from 5 to 7,1962,7.8,29387,1.5,Agnès Varda,Agnès Varda,"Comedy, Drama, Music"
1300,Kapoor & Sons,2016,7.7,29346,2.2,Shakun Batra,"Shakun Batra, Ayesha DeVitre, Spandan Mishra","Comedy, Crime, Drama"
1301,Hanu Man,2024,7.7,29246,2.63,Prasanth Varma,Prasanth Varma,"Action, Adventure, Fantasy"
1302,The Magdalene Sisters,2002,7.7,29215,1.9,Peter Mullan,Peter Mullan,Drama
1303,You Can't Take It with You,1938,7.8,29214,2.1,Frank Capra,"Robert Riskin, George S. Kaufman, Moss Hart","Comedy, Drama, Romance"
1304,Marty,1955,7.7,28712,1.5,Delbert Mann,Paddy Chayefsky,"Drama, Romance"
1305,Eega,2012,7.7,28694,2.42,S.S. Rajamouli,"S.S. Rajamouli, Janardhana Maharshi, Crazy Mohan, Vijayendra Prasad, Mankombu Gopalakrishnan, S.S. Kanchi, Anuj Gurwara","Action, Comedy, Drama"
1306,"What's Up, Doc?",1972,7.7,28679,1.57,Peter Bogdanovich,"Buck Henry, David Newman, Robert Benton, Peter Bogdanovich","Comedy, Romance"
1307,My Dinner with Andre,1981,7.7,28072,1.83,Louis Malle,"Wallace Shawn, Andre Gregory","Comedy, Drama"
1308,How Green Was My Valley,1941,7.7,27795,1.97,John Ford,"Philip Dunne, Richard Llewellyn","Drama, Family"
1309,Aavesham,2024,7.8,27740,2.58,Jithu Madhavan,Jithu Madhavan,"Action, Comedy"
1310,Playtime,1967,7.8,27568,2.58,Jacques Tati,"Jacques Tati, Jacques Lagrange, Art Buchwald",Comedy
1311,Great Expectations,1946,7.8,27416,1.97,David Lean,"Charles Dickens, David Lean, Ronald Neame, Anthony Havelock-Allan, Kay Walsh, Cecil McGivern","Adventure, Drama, Mystery"
1312,My Darling Clementine,1946,7.7,27087,1.62,"John Ford, Lloyd Bacon","Samuel G. Engel, Winston Miller, Sam Hellman, Stuart N. Lake","Drama, Romance, Western"
1313,Never Look Away,2018,7.7,26951,3.15,Florian Henckel von Donnersmarck,Florian Henckel von Donnersmarck,"Biography, Drama, Romance"
1314,Lakshya,2004,7.8,26592,3.1,Farhan Akhtar,"Javed Akhtar, Karan Kashyap, Karan Vishwanath Kashyap","Action, Drama, Romance"
1315,Breaking Away,1979,7.7,26541,1.68,Peter Yates,Steve Tesich,"Comedy, Drama, Sport"
1316,Brother,1997,7.8,26525,1.65,Aleksey Balabanov,Aleksey Balabanov,"Crime, Drama, Thriller"
1317,Magadheera,2009,7.7,26296,2.77,S.S. Rajamouli,"Mankombu Gopalakrishnan, S.S. Kanchi, Prasad Varma Penmatsa, Vijayendra Prasad, S.S. Rajamouli, M. Rathnam, Gautam Siddharth","Action, Drama, Fantasy"
1318,That Obscure Object of Desire,1977,7.8,25960,1.72,Luis Buñuel,"Luis Buñuel, Jean-Claude Carrière, Pierre Louÿs","Comedy, Drama, Romance"
1319,A Place in the Sun,1951,7.7,25816,2.03,George Stevens,"Theodore Dreiser, Patrick Kearney, Michael Wilson, Harry Brown","Drama, Romance"
1320,The Quiet Girl,2022,7.7,25785,1.58,Colm Bairéad,"Claire Keegan, Colm Bairéad",Drama
1321,Guru,2007,7.7,25575,2.77,Mani Ratnam,"Mani Ratnam, Vijay Krishna Acharya, Anurag Kashyap, Sujatha, Suhasini",Drama
1322,Bad Day at Black Rock,1955,7.7,25219,1.35,John Sturges,"Millard Kaufman, Don McGuire, Howard Breslin","Crime, Drama, Mystery"
1323,24,2016,7.8,25174,2.73,Vikram K. Kumar,"Vikram Kumar, Vikram K. Kumar","Action, Comedy, Drama"
1324,Embrace of the Serpent,2015,7.8,25164,2.08,Ciro Guerra,"Cristina Gallego, Ciro Guerra, Theodor Koch-Grünberg, Richard Evans Schultes, Jacques Toulemonde Vidal","Adventure, Biography, Drama"
1325,My Uncle,1958,7.7,25151,1.93,Jacques Tati,"Jacques Lagrange, Jean L'Hôte, Jacques Tati",Comedy
1326,Spider-Man,2002,7.4,919955,2.02,Sam Raimi,"Stan Lee, Steve Ditko, David Koepp","Action, Adventure, Sci-Fi"
1327,Pirates of the Caribbean: Dead Man's Chest,2006,7.4,794932,2.52,Gore Verbinski,"Ted Elliott, Terry Rossio, Stuart Beattie, Jay Wolpert","Action, Adventure, Fantasy"
1328,Spider-Man: Homecoming,2017,7.4,754395,2.22,Jon Watts,"Jonathan Goldstein, John Francis Daley, Jon Watts, Christopher Ford, Chris McKenna, Erik Sommers, Stan Lee, Steve Ditko, Joe Simon, Jack Kirby","Action, Adventure, Sci-Fi"
1329,Harry Potter and the Chamber of Secrets,2002,7.4,726744,2.68,Chris Columbus,"J.K. Rowling, Steve Kloves","Adventure, Family, Fantasy"
1330,Frozen,2013,7.4,686782,1.7,"Chris Buck, Jennifer Lee","Jennifer Lee, Hans Christian Andersen, Chris Buck, Shane Morris","Adventure, Animation, Comedy"
1331,Limitless,2011,7.4,628462,1.75,Neil Burger,"Leslie Dixon, Alan Glynn","Sci-Fi, Thriller"
1332,Looper,2012,7.4,616170,1.98,Rian Johnson,Rian Johnson,"Action, Drama, Sci-Fi"
1333,X2: X-Men United,2003,7.4,596204,2.23,Bryan Singer,"Zak Penn, David Hayter, Bryan Singer, Michael Dougherty, Dan Harris","Action, Sci-Fi, Thriller"
1334,The Hobbit: The Battle of the Five Armies,2014,7.4,595095,2.4,Peter Jackson,"Fran Walsh, Philippa Boyens, Peter Jackson, Guillermo del Toro, J.R.R. Tolkien","Adventure, Fantasy"
1335,Spider-Man: Far from Home,2019,7.4,593404,2.15,Jon Watts,"Chris McKenna, Erik Sommers, Stan Lee, Steve Ditko, Joe Simon, Jack Kirby","Action, Adventure, Comedy"
1336,"Crazy, Stupid, Love.",2011,7.4,589974,1.97,"Glenn Ficarra, John Requa",Dan Fogelman,"Comedy, Drama, Romance"
1337,Juno,2007,7.4,561592,1.6,Jason Reitman,Diablo Cody,"Comedy, Drama"
1338,Mission: Impossible - Ghost Protocol,2011,7.4,541705,2.2,Brad Bird,"Bruce Geller, Josh Appelbaum, André Nemec","Action, Adventure, Thriller"
1339,John Wick: Chapter 2,2017,7.4,538279,2.03,Chad Stahelski,Derek Kolstad,"Action, Crime, Thriller"
1340,Shrek 2,2004,7.4,529420,1.55,"Andrew Adamson, Kelly Asbury, Conrad Vernon","William Steig, Andrew Adamson, Joe Stillman, J. David Stem, David N. Weiss, Cody Cameron, Walt Dohrn, Chris Miller, David P. Smith, Conrad Vernon","Adventure, Animation, Comedy"
1341,Ready Player One,2018,7.4,514571,2.33,Steven Spielberg,"Zak Penn, Ernest Cline","Action, Adventure, Sci-Fi"
1342,The Terminal,2004,7.4,512678,2.13,Steven Spielberg,"Andrew Niccol, Sacha Gervasi, Jeff Nathanson","Comedy, Drama, Romance"
1343,Sherlock Holmes: A Game of Shadows,2011,7.4,491467,2.15,Guy Ritchie,"Michele Mulroney, Kieran Mulroney, Arthur Conan Doyle","Action, Adventure, Mystery"
1344,Borat,2006,7.4,459183,1.4,Larry Charles,"Sacha Baron Cohen, Anthony Hines, Peter Baynham, Dan Mazer, Todd Phillips",Comedy
1345,John Wick: Chapter 3 - Parabellum,2019,7.4,450999,2.17,Chad Stahelski,"Derek Kolstad, Shay Hatten, Chris Collins, Marc Abrams","Action, Crime, Thriller"
1346,Mission: Impossible - Rogue Nation,2015,7.4,423862,2.18,Christopher McQuarrie,"Bruce Geller, Christopher McQuarrie, Drew Pearce","Action, Adventure, Thriller"
1347,Scream,1996,7.4,415829,1.85,Wes Craven,Kevin Williamson,"Horror, Mystery"
1348,The Nice Guys,2016,7.4,393077,1.93,Shane Black,"Shane Black, Anthony Bagarozzi","Action, Comedy, Crime"
1349,Cloud Atlas,2012,7.4,380701,2.87,"Tom Tykwer, Lana Wachowski, Lilly Wachowski","David Mitchell, Lana Wachowski, Tom Tykwer, Lilly Wachowski, Chris Lindsay","Drama, Mystery, Sci-Fi"
1350,The Rock,1996,7.4,368987,2.27,Michael Bay,"David Weisberg, Douglas Cook, Mark Rosner","Action, Adventure, Thriller"
1351,Up in the Air,2009,7.4,354904,1.82,Jason Reitman,"Walter Kirn, Jason Reitman, Sheldon Turner","Comedy, Drama, Romance"
1352,Lady Bird,2017,7.4,350339,1.57,Greta Gerwig,Greta Gerwig,"Comedy, Drama"
1353,Nobody,2021,7.4,348305,1.53,Ilya Naishuller,Derek Kolstad,"Action, Crime, Drama"
1354,Moonlight,2016,7.4,341183,1.85,Barry Jenkins,"Barry Jenkins, Tarell Alvin McCraney",Drama
1355,Uncut Gems,2019,7.4,333826,2.25,"Benny Safdie, Josh Safdie","Ronald Bronstein, Josh Safdie, Benny Safdie","Crime, Drama, Thriller"
1356,Law Abiding Citizen,2009,7.4,333093,1.82,F. Gary Gray,Kurt Wimmer,"Action, Crime, Drama"
1357,Zero Dark Thirty,2012,7.4,329648,2.62,Kathryn Bigelow,Mark Boal,"Drama, History, Thriller"
1358,Nocturnal Animals,2016,7.4,327643,1.93,Tom Ford,"Tom Ford, Austin Wright","Drama, Thriller"
1359,Predestination,2014,7.4,321099,1.62,"Michael Spierig, Peter Spierig","Michael Spierig, Peter Spierig, Robert A. Heinlein","Action, Drama, Sci-Fi"
1360,War for the Planet of the Apes,2017,7.4,315046,2.33,Matt Reeves,"Mark Bomback, Matt Reeves, Rick Jaffa, Amanda Silver, Pierre Boulle","Action, Adventure, Drama"
1361,Corpse Bride,2005,7.4,312948,1.28,"Tim Burton, Mike Johnson","Tim Burton, Carlos Grangel, John August, Caroline Thompson, Pamela Pettler","Animation, Comedy, Drama"
1362,Sully,2016,7.4,310791,1.6,Clint Eastwood,"Todd Komarnicki, Chesley Sullenberger, Jeffrey Zaslow","Biography, Drama"
1363,Me Before You,2016,7.4,308884,1.83,Thea Sharrock,Jojo Moyes,"Drama, Romance"
1364,The Lighthouse,2019,7.4,281194,1.82,Robert Eggers,"Robert Eggers, Max Eggers","Drama, Fantasy, Horror"
1365,A Nightmare on Elm Street,1984,7.4,276825,1.52,Wes Craven,Wes Craven,Horror
1366,A History of Violence,2005,7.4,263709,1.6,David Cronenberg,"John Wagner, Vince Locke, Josh Olson","Action, Crime, Drama"
1367,The Talented Mr. Ripley,1999,7.4,260576,2.32,Anthony Minghella,"Patricia Highsmith, Anthony Minghella","Crime, Drama, Thriller"
1368,Dracula,1992,7.4,255214,2.13,Francis Ford Coppola,"Bram Stoker, James V. Hart","Fantasy, Horror, Romance"
1369,The Evil Dead,1981,7.4,241944,1.42,Sam Raimi,Sam Raimi,Horror
1370,The Emperor's New Groove,2000,7.4,236731,1.3,Mark Dindal,"Chris Williams, Mark Dindal, David Reynolds, Stephen J. Anderson, Don Hall, John Norton, Roger Allers, Matthew Jacobs, Doug Frankel, Mark Kennedy, Mark Walton","Adventure, Animation, Comedy"
1371,Darkest Hour,2017,7.4,230634,2.08,Joe Wright,Anthony McCarten,"Biography, Drama, History"
1372,Garden State,2004,7.4,226266,1.7,Zach Braff,Zach Braff,"Comedy, Drama, Romance"
1373,Beverly Hills Cop,1984,7.4,223431,1.75,Martin Brest,"Daniel Petrie Jr., Danilo Bach","Action, Comedy, Crime"
1374,Carrie,1976,7.4,217365,1.63,Brian De Palma,"Stephen King, Lawrence D. Cohen","Horror, Mystery"
1375,The Judge,2014,7.4,213228,2.35,David Dobkin,"Nick Schenk, Bill Dubuque, David Dobkin","Crime, Drama, Mystery"
1376,Luca,2021,7.4,209206,1.58,Enrico Casarosa,"Enrico Casarosa, Jesse Andrews, Simon Stephenson, Mike Jones, Julie Lynn, Randall Green","Adventure, Animation, Comedy"
1377,The English Patient,1996,7.4,208348,2.7,Anthony Minghella,"Michael Ondaatje, Anthony Minghella","Drama, Romance, War"
1378,REC,2007,7.4,206497,1.3,"Jaume Balagueró, Paco Plaza","Jaume Balagueró, Luiso Berdejo, Paco Plaza","Horror, Mystery, Thriller"
1379,Army of Darkness,1992,7.4,201650,1.35,Sam Raimi,"Sam Raimi, Ivan Raimi","Comedy, Horror"
1380,Palm Springs,2020,7.4,198104,1.5,Max Barbakow,"Andy Siara, Max Barbakow","Comedy, Fantasy, Mystery"
1381,The Texas Chain Saw Massacre,1974,7.4,197313,1.38,Tobe Hooper,"Kim Henkel, Tobe Hooper",Horror
1382,K-PAX,2001,7.4,197055,2.0,Iain Softley,"Gene Brewer, Charles Leavitt","Drama, Mystery, Sci-Fi"
1383,Molly's Game,2017,7.4,196493,2.33,Aaron Sorkin,"Aaron Sorkin, Molly Bloom","Biography, Crime, Drama"
1384,Superman,1978,7.4,195568,2.38,Richard Donner,"Jerry Siegel, Joe Shuster, Mario Puzo, David Newman, Leslie Newman, Robert Benton, Tom Mankiewicz","Action, Adventure, Sci-Fi"
1385,High Fidelity,2000,7.4,194620,1.88,Stephen Frears,"Nick Hornby, D.V. DeVincentis, Steve Pink, John Cusack, Scott Rosenberg","Comedy, Drama, Music"
1386,Mud,2012,7.4,194217,2.17,Jeff Nichols,Jeff Nichols,"Adventure, Drama"
1387,Galaxy Quest,1999,7.4,185182,1.7,Dean Parisot,"David Howard, Robert Gordon","Adventure, Comedy, Sci-Fi"
1388,Air,2023,7.4,182936,1.85,Ben Affleck,Alex Convery,"Drama, Sport"
1389,Onward,2020,7.4,178596,1.7,Dan Scanlon,"Dan Scanlon, Keith Bunin, Jason Headley","Adventure, Animation, Comedy"
1390,The Rocky Horror Picture Show,1975,7.4,174497,1.67,Jim Sharman,"Richard O'Brien, Jim Sharman","Comedy, Horror, Musical"
1391,We Need to Talk About Kevin,2011,7.4,174169,1.87,Lynne Ramsay,"Lynne Ramsay, Rory Stewart Kinnear, Lionel Shriver","Drama, Mystery, Thriller"
1392,Begin Again,2013,7.4,171556,1.73,John Carney,John Carney,"Comedy, Drama, Music"
1393,Inside Llewyn Davis,2013,7.4,167636,1.73,"Ethan Coen, Joel Coen","Joel Coen, Ethan Coen","Drama, Music"
1394,The Orphanage,2007,7.4,167181,1.75,J.A. Bayona,Sergio G. Sánchez,"Drama, Horror, Mystery"
1395,Green Street Hooligans,2005,7.4,166211,1.82,Lexi Alexander,"Lexi Alexander, Dougie Brimson, Josh Shelov","Crime, Drama, Sport"
1396,How to Train Your Dragon: The Hidden World,2019,7.4,162929,1.73,Dean DeBlois,"Dean DeBlois, Cressida Cowell","Action, Adventure, Animation"
1397,The Way Way Back,2013,7.4,160123,1.72,"Nat Faxon, Jim Rash","Nat Faxon, Jim Rash","Comedy, Drama"
1398,Phantom Thread,2017,7.4,151422,2.17,Paul Thomas Anderson,Paul Thomas Anderson,"Drama, Romance"
1399,Conclave,2024,7.4,144603,2.0,Edward Berger,"Peter Straughan, Robert Harris","Drama, Thriller"
1400,Man on the Moon,1999,7.4,140631,1.97,Milos Forman,"Scott Alexander, Larry Karaszewski","Biography, Comedy, Drama"
1401,National Lampoon's Animal House,1978,7.4,132586,1.82,John Landis,"Harold Ramis, Douglas Kenney, Chris Miller",Comedy
1402,Crimson Tide,1995,7.4,129959,1.93,Tony Scott,"Michael Schiffer, Richard P. Henrick","Action, Drama, Thriller"
1403,A League of Their Own,1992,7.4,125400,2.13,Penny Marshall,"Kim Wilson, Kelly Candaele, Lowell Ganz, Babaloo Mandel","Comedy, Drama, Sport"
1404,Jacob's Ladder,1990,7.4,123224,1.88,Adrian Lyne,Bruce Joel Rubin,"Drama, Horror, Mystery"
1405,A Single Man,2009,7.5,120106,1.65,Tom Ford,"Christopher Isherwood, Tom Ford, David Scearce","Drama, Romance, Thriller"
1406,Little Children,2006,7.5,119432,2.28,Todd Field,"Todd Field, Tom Perrotta","Drama, Romance"
1407,Frequency,2000,7.4,119306,1.97,Gregory Hoblit,Toby Emmerich,"Crime, Drama, Mystery"
1408,Malena,2000,7.4,118812,1.8,Giuseppe Tornatore,"Giuseppe Tornatore, Luciano Vincenzoni","Drama, Romance, War"
1409,Tootsie,1982,7.4,118450,1.93,Sydney Pollack,"Don McGuire, Larry Gelbart, Murray Schisgal, Barry Levinson, Robert Garland, Robert Kaufman, Elaine May","Comedy, Drama, Romance"
1410,House of Flying Daggers,2004,7.5,117886,1.98,Yimou Zhang,"Feng Li, Bin Wang, Yimou Zhang","Action, Adventure, Drama"
1411,The Man Who Wasn't There,2001,7.5,117727,1.93,Joel Coen,"Joel Coen, Ethan Coen","Crime, Drama"
1412,The Warriors,1979,7.5,115228,1.55,Walter Hill,"Sol Yurick, David Shaber, Walter Hill","Action, Crime, Thriller"
1413,Ip Man 2,2010,7.5,113716,1.8,Wilson Yip,"Tai-Lee Chan, Hiu-Yan Choi, David Tadman, Edmond Wong","Action, Biography, Drama"
1414,Beautiful Boy,2018,7.4,113338,2.0,Felix van Groeningen,"Luke Davies, Felix van Groeningen, David Sheff, Nic Sheff","Biography, Drama"
1415,August Rush,2007,7.4,112819,1.9,Kirsten Sheridan,"Nick Castle, James V. Hart, Paul Castro","Drama, Music"
1416,Lolita,1962,7.5,112184,2.55,Stanley Kubrick,"Vladimir Nabokov, Stanley Kubrick, James B. Harris","Crime, Drama, Romance"
1417,American Fiction,2023,7.5,110111,1.95,Cord Jefferson,"Cord Jefferson, Percival Everett","Comedy, Drama"
1418,Blood Simple,1984,7.5,109615,1.65,"Joel Coen, Ethan Coen","Joel Coen, Ethan Coen","Crime, Drama, Thriller"
1419,Headhunters,2011,7.5,109223,1.67,Morten Tyldum,"Ulf Ryberg, Lars Gudmestad, Jo Nesbø","Action, Crime, Thriller"
1420,Witness,1985,7.4,108894,1.87,Peter Weir,"William Kelley, Pamela Wallace, Earl W. Wallace","Drama, Romance, Thriller"
1421,Elizabeth,1998,7.4,107896,2.07,Shekhar Kapur,Michael Hirst,"Biography, Drama, History"
1422,The Cider House Rules,1999,7.4,107169,2.1,Lasse Hallström,John Irving,"Drama, Romance"
1423,Dead Alive,1992,7.5,106666,1.73,Peter Jackson,"Stephen Sinclair, Fran Walsh, Peter Jackson","Comedy, Fantasy, Horror"
1424,Dead Man,1995,7.5,105906,2.02,Jim Jarmusch,Jim Jarmusch,"Adventure, Drama, Western"
1425,Boys Don't Cry,1999,7.5,105853,1.97,Kimberly Peirce,"Kimberly Peirce, Andy Bienen","Biography, Crime, Drama"
1426,Following,1998,7.4,105623,1.15,Christopher Nolan,Christopher Nolan,"Crime, Mystery, Thriller"
1427,42,2013,7.5,105598,2.13,Brian Helgeland,Brian Helgeland,"Biography, Drama, Sport"
1428,Dead Man Walking,1995,7.5,104699,2.03,Tim Robbins,"Helen Prejean, Tim Robbins","Crime, Drama"
1429,Minari,2020,7.4,103527,1.92,Lee Isaac Chung,Lee Isaac Chung,Drama
1430,Tár,2022,7.4,103161,2.63,Todd Field,Todd Field,"Drama, Music"
1431,The Land Before Time,1988,7.4,102863,1.15,Don Bluth,"Stu Krieger, Judy Freudberg, Tony Geiss","Adventure, Animation, Drama"
1432,"Good Night, and Good Luck.",2005,7.4,102854,1.55,George Clooney,"George Clooney, Grant Heslov","Biography, Drama, History"
1433,Richard Jewell,2019,7.5,102601,2.18,Clint Eastwood,"Billy Ray, Marie Brenner, Kent Alexander, Kevin Salwen","Biography, Crime, Drama"
1434,American Graffiti,1973,7.4,101889,1.83,George Lucas,"George Lucas, Gloria Katz, Willard Huyck","Comedy, Drama"
1435,"Synecdoche, New York",2008,7.5,101318,2.07,Charlie Kaufman,Charlie Kaufman,Drama
1436,Reign Over Me,2007,7.4,101009,2.07,Mike Binder,Mike Binder,Drama
1437,Ghost Dog: The Way of the Samurai,1999,7.5,100379,1.93,Jim Jarmusch,Jim Jarmusch,"Crime, Drama"
1438,The Wicker Man,1973,7.5,99347,1.47,Robin Hardy,"Anthony Shaffer, David Pinner","Horror, Mystery, Thriller"
1439,Midnight Run,1988,7.5,98940,2.1,Martin Brest,George Gallo,"Action, Comedy, Crime"
1440,Frances Ha,2012,7.4,98289,1.43,Noah Baumbach,"Noah Baumbach, Greta Gerwig","Comedy, Drama, Romance"
1441,The Piano,1993,7.5,98158,2.02,Jane Campion,Jane Campion,"Drama, Music, Romance"
1442,The Painted Veil,2006,7.4,97965,2.08,John Curran,"Ron Nyswaner, W. Somerset Maugham","Drama, Romance"
1443,Selma,2014,7.5,97418,2.13,Ava DuVernay,Paul Webb,"Biography, Drama, History"
1444,A Monster Calls,2016,7.4,96355,1.8,J.A. Bayona,"Patrick Ness, Siobhan Dowd","Adventure, Drama, Family"
1445,Biutiful,2010,7.4,96323,2.47,Alejandro G. Iñárritu,"Alejandro G. Iñárritu, Armando Bo, Nicolás Giacobone","Drama, Romance"
1446,Tetris,2023,7.4,96064,1.97,Jon S. Baird,Noah Pink,"Biography, Drama, History"
1447,Judas and the Black Messiah,2021,7.4,94607,2.1,Shaka King,"Will Berson, Shaka King, Kenneth Lucas, Keith Lucas","Biography, Drama, History"
1448,The Boy and the Heron,2023,7.4,93870,2.07,Hayao Miyazaki,Hayao Miyazaki,"Adventure, Animation, Drama"
1449,The Fisher King,1991,7.5,93768,2.28,Terry Gilliam,Richard LaGravenese,"Comedy, Drama, Fantasy"
1450,La Vie En Rose,2007,7.5,92245,2.33,Olivier Dahan,"Isabelle Sobelman, Olivier Dahan","Biography, Drama, Music"
1451,Delicatessen,1991,7.5,92142,1.65,"Marc Caro, Jean-Pierre Jeunet","Jean-Pierre Jeunet, Marc Caro, Gilles Adrien","Comedy, Crime"
1452,Midnight Express,1978,7.5,91042,2.02,Alan Parker,"Oliver Stone, Billy Hayes, William Hoffer","Biography, Crime, Drama"
1453,A Perfect World,1993,7.5,90410,2.3,Clint Eastwood,John Lee Hancock,"Crime, Drama, Thriller"
1454,The Wailing,2016,7.4,90362,2.6,Na Hong-jin,Na Hong-jin,"Drama, Horror"
1455,Funny Games,1997,7.5,89804,1.8,Michael Haneke,Michael Haneke,"Crime, Drama, Thriller"
1456,Lady Vengeance,2005,7.5,89031,1.92,Park Chan-wook,"Chung Seo-kyung, Park Chan-wook, Park Myeong-chan","Crime, Drama, Thriller"
1457,Fruitvale Station,2013,7.5,87779,1.42,Ryan Coogler,Ryan Coogler,"Biography, Crime, Drama"
1458,Notes on a Scandal,2006,7.4,87132,1.53,Richard Eyre,"Patrick Marber, Zoë Heller","Crime, Drama, Romance"
1459,Master,2021,7.4,86126,2.98,Lokesh Kanagaraj,"Lokesh Kanagaraj, Pon Parthiban, Rathna Kumar, Shivgopal Krishna","Action, Crime, Drama"
1460,Trumbo,2015,7.4,86045,2.07,Jay Roach,"John McNamara, Bruce Cook","Biography, Drama"
1461,Felon,2008,7.4,86021,1.73,Ric Roman Waugh,Ric Roman Waugh,"Action, Drama, Thriller"
1462,An Inconvenient Truth,2006,7.4,86003,1.6,Davis Guggenheim,Al Gore,Documentary
1463,Miss Sloane,2016,7.5,85814,2.2,John Madden,Jonathan Perera,Drama
1464,To Catch a Thief,1955,7.4,83440,1.77,Alfred Hitchcock,"John Michael Hayes, David Dodge, Alec Coppel","Drama, Mystery, Romance"
1465,Mid90s,2018,7.4,82622,1.42,Jonah Hill,Jonah Hill,"Comedy, Drama"
1466,Dirty Rotten Scoundrels,1988,7.4,82369,1.83,Frank Oz,"Dale Launer, Stanley Shapiro, Paul Henning","Comedy, Crime"
1467,Burning,2018,7.4,81234,2.47,Lee Chang-dong,"Jungmi Oh, Lee Chang-dong, Haruki Murakami, William Faulkner","Drama, Mystery"
1468,Open Range,2003,7.4,81178,2.32,Kevin Costner,"Lauran Paine, Craig Storper","Action, Drama, Romance"
1469,A Simple Plan,1998,7.5,79540,2.02,Sam Raimi,Scott B. Smith,"Crime, Drama, Thriller"
1470,Disconnect,2012,7.5,79066,1.92,Henry Alex Rubin,Andrew Stern,"Crime, Drama, Mystery"
1471,Bullitt,1968,7.4,78625,1.9,Peter Yates,"Alan Trustman, Harry Kleiner, Robert L. Fish","Action, Crime, Thriller"
1472,Sympathy for Mr. Vengeance,2002,7.5,77838,2.15,Park Chan-wook,"Jong-yong Lee, Jae-sun Lee, Mu-yeong Lee, Park Chan-wook, Park Myeong-chan","Crime, Drama, Thriller"
1473,The Brutalist,2024,7.4,77573,3.6,Brady Corbet,"Brady Corbet, Mona Fastvold",Drama
1474,Dangerous Liaisons,1988,7.5,77396,1.98,Stephen Frears,"Christopher Hampton, Choderlos de Laclos","Drama, Romance"
1475,The Piano Teacher,2001,7.5,75804,2.18,Michael Haneke,"Michael Haneke, Elfriede Jelinek","Drama, Music"
1476,Invasion of the Body Snatchers,1978,7.4,75630,1.92,Philip Kaufman,"W.D. Richter, Jack Finney","Horror, Sci-Fi"
1477,Quiz Show,1994,7.5,75269,2.22,Robert Redford,"Paul Attanasio, Richard N. Goodwin","Biography, Drama, History"
1478,Hunger,2008,7.5,75117,1.6,Steve McQueen,"Enda Walsh, Steve McQueen","Biography, Crime, Drama"
1479,House of Sand and Fog,2003,7.5,74321,2.1,Vadim Perelman,"Andre Dubus III, Vadim Perelman, Shawn Lawrence Otto","Crime, Drama"
1480,The Farewell,2019,7.5,73697,1.67,Lulu Wang,Lulu Wang,"Comedy, Drama"
