puesto,titulo,año,puntuacion,votos,duracion_horas,directores,escritores,generos
2348,Manderlay,2005,7.2,25796,2.22,Lars von Trier,Lars von Trier,Drama
2349,Breathe,2017,7.2,25708,1.97,Andy Serkis,William Nicholson,"Biography, Drama, Romance"
2350,The Bird with the Crystal Plumage,1970,7.1,25697,1.6,Dario Argento,"Dario Argento, Fredric Brown","Drama, Horror, Mystery"
2351,Pirates of Silicon Valley,1999,7.2,25667,1.58,Martyn Burke,"Paul Freiberger, Michael Swaine, Martyn Burke","Biography, Drama, History"
2352,Them!,1954,7.2,25511,1.57,Gordon Douglas,"Ted Sherdeman, Russell S. Hughes, George Worthing Yates","Horror, Sci-Fi"
2353,Sonu Ke Titu Ki Sweety,2018,7.1,25499,2.3,Luv Ranjan,"Rahul Mody, Luv Ranjan","Comedy, Romance"
2354,Love & Basketball,2000,7.2,25486,2.07,Gina Prince-Bythewood,Gina Prince-Bythewood,"Drama, Romance, Sport"
2355,Breakfast on Pluto,2005,7.2,25370,2.13,Neil Jordan,"Neil Jordan, Pat McCabe","Comedy, Drama"
2356,Brother,2000,7.1,25264,1.9,Takeshi Kitano,Takeshi Kitano,"Crime, Drama, Thriller"
2357,Vikram Vedha,2022,7.1,25222,2.67,"Gayatri, Pushkar","Benazir Ali Fida, Gayatri, Manoj Muntashir, Pushkar","Action, Crime, Drama"
2358,The Parent Trap,1961,7.2,25200,2.15,David Swift,"David Swift, Erich Kästner","Comedy, Family, Romance"
2359,Sector 36,2024,7.1,25167,2.05,Aditya Nimbalkar,Bodhayan Roychaudhury,"Crime, Drama, Thriller"
2360,The Vaccine War,2023,7.1,25122,2.68,Vivek Agnihotri,Vivek Agnihotri,"Drama, Thriller"
2361,Iron Man 3,2013,7.1,929173,2.17,Shane Black,"Drew Pearce, Shane Black, Stan Lee, Don Heck, Larry Lieber, Jack Kirby, Warren Ellis, Adi Granov","Action, Adventure, Sci-Fi"
2362,Man of Steel,2013,7.1,832390,2.38,Zack Snyder,"David S. Goyer, Christopher Nolan, Jerry Siegel, Joe Shuster","Action, Adventure, Sci-Fi"
2363,Pirates of the Caribbean: At World's End,2007,7.1,717251,2.82,Gore Verbinski,"Ted Elliott, Terry Rossio, Stuart Beattie, Jay Wolpert","Action, Adventure, Fantasy"
2364,Transformers,2007,7.1,695566,2.4,Michael Bay,"Roberto Orci, Alex Kurtzman, John Rogers","Action, Adventure, Sci-Fi"
2365,"I, Robot",2004,7.1,595184,1.92,Alex Proyas,"Jeff Vintar, Akiva Goldsman, Isaac Asimov","Action, Mystery, Sci-Fi"
2366,The 40-Year-Old Virgin,2005,7.1,484179,1.93,Judd Apatow,"Judd Apatow, Steve Carell","Comedy, Romance"
2367,The Mummy,1999,7.1,480839,2.07,Stephen Sommers,"Stephen Sommers, Lloyd Fonvielle, Kevin Jarre, John L. Balderston, Nina Wilcox Putnam, Richard Schayer","Action, Adventure, Fantasy"
2368,Glass Onion,2022,7.1,474303,2.32,Rian Johnson,Rian Johnson,"Comedy, Crime, Drama"
2369,Tropic Thunder,2008,7.1,466563,1.78,Ben Stiller,"Justin Theroux, Ben Stiller, Etan Cohen","Action, Comedy, War"
2370,Brave,2012,7.1,460587,1.55,"Mark Andrews, Brenda Chapman, Steve Purcell","Brenda Chapman, Mark Andrews, Steve Purcell, Irene Mecchi","Action, Adventure, Animation"
2371,Free Guy,2021,7.1,460247,1.92,Shawn Levy,"Matt Lieberman, Zak Penn","Action, Adventure, Comedy"
2372,Mean Girls,2004,7.1,459605,1.62,Mark Waters,"Rosalind Wiseman, Tina Fey",Comedy
2373,Midsommar,2019,7.1,445318,2.47,Ari Aster,Ari Aster,"Drama, Horror, Mystery"
2374,Live Free or Die Hard,2007,7.1,428520,2.13,Len Wiseman,"John Carlin, Roderick Thorp, Mark Bomback, David Marconi","Action, Thriller"
2375,Furious 7,2015,7.1,426227,2.28,James Wan,"Chris Morgan, Gary Scott Thompson","Action, Thriller"
2376,Snowpiercer,2013,7.1,405571,2.1,Bong Joon Ho,"Jacques Lob, Benjamin Legrand, Jean-Marc Rochette, Bong Joon Ho, Kelly Masterson","Action, Sci-Fi, Thriller"
2377,Die Hard 2,1990,7.1,395837,2.07,Renny Harlin,"Steven E. de Souza, Doug Richardson, Walter Wager, Roderick Thorp","Action, Thriller"
2378,Jumanji,1995,7.1,394103,1.73,Joe Johnston,"Jonathan Hensleigh, Greg Taylor, Jim Strain, Chris Van Allsburg","Adventure, Comedy, Family"
2379,Anchorman: The Legend of Ron Burgundy,2004,7.1,389589,1.57,Adam McKay,"Will Ferrell, Adam McKay",Comedy
2380,The Ring,2002,7.1,388682,1.92,Gore Verbinski,"Ehren Kruger, Kôji Suzuki, Hiroshi Takahashi","Horror, Mystery"
2381,Pretty Woman,1990,7.1,384579,1.98,Garry Marshall,J.F. Lawton,"Comedy, Romance"
2382,Real Steel,2011,7.1,369615,2.12,Shawn Levy,"John Gatins, Dan Gilroy, Jeremy Leven, Richard Matheson","Action, Drama, Sci-Fi"
2383,Shooter,2007,7.1,365720,2.07,Antoine Fuqua,"Stephen Hunter, Jonathan Lemkin","Action, Drama, Thriller"
2384,The Mist,2007,7.1,357238,2.1,Frank Darabont,"Frank Darabont, Stephen King","Horror, Sci-Fi, Thriller"
2385,Beauty and the Beast,2017,7.1,346990,2.15,Bill Condon,"Stephen Chbosky, Evan Spiliotopoulos, Linda Woolverton, Jeanne-Marie Leprince de Beaumont, Gabrielle-Suzanne Barbot de Villeneuve","Adventure, Family, Fantasy"
2386,Pitch Perfect,2012,7.1,340104,1.87,Jason Moore,"Kay Cannon, Mickey Rapkin","Comedy, Music, Romance"
2387,Batman Returns,1992,7.1,339210,2.1,Tim Burton,"Bob Kane, Daniel Waters, Sam Hamm","Action, Crime, Fantasy"
2388,There's Something About Mary,1998,7.1,338560,1.98,"Bobby Farrelly, Peter Farrelly","Ed Decter, John J. Strauss, Peter Farrelly, Bobby Farrelly","Comedy, Romance"
2389,Deja Vu,2006,7.1,336706,2.1,Tony Scott,"Bill Marsilii, Terry Rossio","Action, Crime, Sci-Fi"
2390,Elf,2003,7.1,329349,1.62,Jon Favreau,David Berenbaum,"Adventure, Comedy, Family"
2391,The Lobster,2015,7.1,318175,1.98,Yorgos Lanthimos,"Yorgos Lanthimos, Efthimis Filippou","Drama, Romance, Sci-Fi"
2392,Don't Breathe,2016,7.1,316878,1.47,Fede Alvarez,"Fede Alvarez, Rodo Sayagues","Crime, Horror, Thriller"
2393,Blade,1998,7.1,316347,2.0,Stephen Norrington,David S. Goyer,"Action, Horror, Sci-Fi"
2394,Forgetting Sarah Marshall,2008,7.1,309860,1.85,Nicholas Stoller,Jason Segel,"Comedy, Drama, Romance"
2395,Dredd,2012,7.1,304178,1.58,Pete Travis,"John Wagner, Carlos Ezquerra, Alex Garland","Action, Crime, Sci-Fi"
2396,Mrs. Doubtfire,1993,7.1,303544,2.08,Chris Columbus,"Anne Fine, Randi Mayem Singer, Leslie Dixon","Comedy, Drama"
2397,Phone Booth,2002,7.1,294139,1.35,Joel Schumacher,Larry Cohen,"Crime, Thriller"
2398,The Intern,2015,7.1,292148,2.02,Nancy Meyers,Nancy Meyers,"Comedy, Drama"
2399,Seven Psychopaths,2012,7.1,280796,1.83,Martin McDonagh,Martin McDonagh,"Comedy, Crime"
2400,War Dogs,2016,7.1,276387,1.9,Todd Phillips,"Stephen Chin, Todd Phillips, Jason Smilovic, Guy Lawson","Biography, Comedy, Crime"
2401,Vicky Cristina Barcelona,2008,7.1,274360,1.6,Woody Allen,Woody Allen,"Comedy, Drama, Romance"
2402,The Invisible Man,2020,7.1,270164,2.07,Leigh Whannell,"Leigh Whannell, H.G. Wells","Drama, Horror, Mystery"
2403,Dirty Dancing,1987,7.1,268502,1.67,Emile Ardolino,Eleanor Bergstein,"Drama, Music, Romance"
2404,Valkyrie,2008,7.1,266137,2.02,Bryan Singer,"Christopher McQuarrie, Nathan Alexander","Drama, History, Thriller"
2405,Cube,1997,7.1,254842,1.5,Vincenzo Natali,"André Bijelic, Vincenzo Natali, Graeme Manson","Horror, Mystery, Sci-Fi"
2406,Ghost,1990,7.1,247281,2.1,Jerry Zucker,Bruce Joel Rubin,"Drama, Fantasy, Romance"
2407,Prey,2022,7.1,246810,1.67,Dan Trachtenberg,"Patrick Aison, Dan Trachtenberg, Jim Thomas, John Thomas","Action, Adventure, Horror"
2408,Alien: Romulus,2024,7.1,242928,1.98,Fede Alvarez,"Dan O'Bannon, Ronald Shusett, Fede Alvarez, Rodo Sayagues","Horror, Sci-Fi, Thriller"
2409,The Croods,2013,7.1,241406,1.63,"Kirk DeMicco, Chris Sanders","Kirk DeMicco, Chris Sanders, John Cleese","Adventure, Animation, Comedy"
2410,Everest,2015,7.1,239760,2.02,Baltasar Kormákur,"William Nicholson, Simon Beaufoy","Adventure, Biography, Drama"
2411,Shakespeare in Love,1998,7.1,238541,2.05,John Madden,"Marc Norman, Tom Stoppard","Comedy, Drama, History"
2412,Rocky Balboa,2006,7.1,236958,1.7,Sylvester Stallone,Sylvester Stallone,"Drama, Sport"
2413,The Ides of March,2011,7.1,235204,1.68,George Clooney,"George Clooney, Grant Heslov, Beau Willimon","Drama, Thriller"
2414,Coming to America,1988,7.1,231893,1.95,John Landis,"Eddie Murphy, David Sheffield, Barry W. Blaustein","Comedy, Romance"
2415,Basic Instinct,1992,7.1,231053,2.12,Paul Verhoeven,Joe Eszterhas,"Drama, Mystery, Thriller"
2416,Enchanted,2007,7.1,223480,1.78,Kevin Lima,Bill Kelly,"Adventure, Animation, Comedy"
2417,Wrath of Man,2021,7.1,222946,1.98,Guy Ritchie,"Nicolas Boukhrief, Éric Besnard, Guy Ritchie, Ivan Atkinson, Marn Davies","Action, Crime, Thriller"
2418,American Made,2017,7.1,218903,1.92,Doug Liman,Gary Spinelli,"Action, Comedy, Crime"
2419,Chicken Run,2000,7.1,218708,1.4,"Peter Lord, Nick Park","Peter Lord, Nick Park, Karey Kirkpatrick, Mark Burton, John O'Farrell","Adventure, Animation, Comedy"
2420,Spaceballs,1987,7.1,214474,1.6,Mel Brooks,"Mel Brooks, Thomas Meehan, Ronny Graham","Adventure, Comedy, Sci-Fi"
2421,Kung Fu Panda 3,2016,7.1,203475,1.58,"Alessandro Carloni, Jennifer Yuh Nelson","Jonathan Aibel, Glenn Berger, Ethan Reiff, Cyrus Voris","Action, Adventure, Animation"
2422,The Danish Girl,2015,7.1,203168,1.98,Tom Hooper,"Lucinda Coxon, David Ebershoff","Biography, Drama"
2423,Desperado,1995,7.1,202916,1.73,Robert Rodriguez,Robert Rodriguez,"Action, Crime, Drama"
2424,Sing,2016,7.1,202044,1.8,"Garth Jennings, Christophe Lourdelet",Garth Jennings,"Animation, Comedy, Family"
2425,Melancholia,2011,7.1,201841,2.25,Lars von Trier,Lars von Trier,"Drama, Sci-Fi"
2426,Side Effects,2013,7.1,200943,1.77,Steven Soderbergh,Scott Z. Burns,"Crime, Drama, Mystery"
2427,About a Boy,2002,7.1,195851,1.68,"Chris Weitz, Paul Weitz","Nick Hornby, Peter Hedges, Chris Weitz, Paul Weitz","Comedy, Drama, Romance"
2428,Babylon,2022,7.1,192452,3.15,Damien Chazelle,Damien Chazelle,"Comedy, Drama, History"
2429,The Master,2012,7.1,191735,2.3,Paul Thomas Anderson,Paul Thomas Anderson,"Drama, History"
2430,Deepwater Horizon,2016,7.1,190922,1.78,Peter Berg,"Matthew Michael Carnahan, Matthew Sand, David Barstow, David Rohde, Stephanie Saul","Action, Drama, History"
2431,Three Kings,1999,7.1,184065,1.9,David O. Russell,"John Ridley, David O. Russell","Action, Adventure, Comedy"
2432,Talk to Me,2022,7.1,181253,1.58,"Danny Philippou, Michael Philippou","Danny Philippou, Bill Hinzman, Daley Pearson","Horror, Thriller"
2433,Sicario: Day of the Soldado,2018,7.1,178699,2.03,Stefano Sollima,Taylor Sheridan,"Action, Crime, Drama"
2434,"Definitely, Maybe",2008,7.1,178186,1.87,Adam Brooks,Adam Brooks,"Comedy, Drama, Romance"
2435,Allied,2016,7.1,175108,2.07,Robert Zemeckis,Steven Knight,"Action, Drama, Romance"
2436,Four Weddings and a Funeral,1994,7.1,173387,1.95,Mike Newell,Richard Curtis,"Comedy, Drama, Romance"
2437,Bad Times at the El Royale,2018,7.1,172328,2.35,Drew Goddard,Drew Goddard,"Crime, Drama, Mystery"
2438,Spy Game,2001,7.1,172113,2.1,Tony Scott,"Michael Frost Beckner, David Arata","Action, Crime, Thriller"
2439,Escape from New York,1981,7.1,165189,1.65,John Carpenter,"John Carpenter, Nick Castle","Action, Adventure, Sci-Fi"
2440,Locke,2013,7.1,164035,1.42,Steven Knight,Steven Knight,Drama
2441,State of Play,2009,7.1,163736,2.12,Kevin Macdonald,"Matthew Michael Carnahan, Tony Gilroy, Billy Ray, Paul Abbott","Crime, Drama, Mystery"
2442,"Love, Rosie",2014,7.1,162124,1.7,Christian Ditter,"Juliette Towhidi, Cecelia Ahern","Comedy, Romance"
2443,Creed II,2018,7.1,161885,2.17,Steven Caple Jr.,"Juel Taylor, Sylvester Stallone, Sascha Penn, Cheo Hodari Coker, Steven Caple Jr.","Action, Drama, Sport"
2444,The Time Traveler's Wife,2009,7.1,161879,1.78,Robert Schwentke,"Bruce Joel Rubin, Audrey Niffenegger","Drama, Fantasy, Romance"
2445,Seven Years in Tibet,1997,7.1,161377,2.27,Jean-Jacques Annaud,"Heinrich Harrer, Becky Johnston","Adventure, Biography, Drama"
2446,The Devil All the Time,2020,7.1,161049,2.3,Antonio Campos,"Antonio Campos, Paulo Campos, Donald Ray Pollock","Crime, Drama, Thriller"
2447,Brothers,2009,7.1,159800,1.75,Jim Sheridan,"David Benioff, Susanne Bier, Anders Thomas Jensen","Drama, Thriller, War"
2448,Remember Me,2010,7.1,159191,1.88,Allen Coulter,Will Fetters,"Drama, Romance"
2449,The French Dispatch,2021,7.1,158512,1.78,Wes Anderson,"Wes Anderson, Roman Coppola, Hugo Guinness, Jason Schwartzman","Comedy, Drama, Romance"
2450,Defiance,2008,7.1,158475,2.28,Edward Zwick,"Clayton Frohman, Edward Zwick, Nechama Tec","Action, Drama, History"
2451,Never Let Me Go,2010,7.1,156437,1.72,Mark Romanek,"Alex Garland, Kazuo Ishiguro","Drama, Romance"
2452,Winter's Bone,2010,7.1,154199,1.67,Debra Granik,"Debra Granik, Anne Rosellini, Daniel Woodrell","Crime, Drama, Mystery"
2453,Margin Call,2011,7.1,152336,1.78,J.C. Chandor,J.C. Chandor,"Drama, Thriller"
2454,It's Kind of a Funny Story,2010,7.1,150232,1.68,"Anna Boden, Ryan Fleck","Anna Boden, Ryan Fleck, Ned Vizzini","Comedy, Drama, Romance"
2455,Payback,1999,7.1,149574,1.67,Brian Helgeland,"Donald E. Westlake, Brian Helgeland, Terry Hayes","Action, Crime, Drama"
2456,John Q,2002,7.1,148526,1.93,Nick Cassavetes,James Kearns,"Crime, Drama, Thriller"
2457,Licorice Pizza,2021,7.1,147531,2.22,Paul Thomas Anderson,Paul Thomas Anderson,"Comedy, Drama, Romance"
2458,Wild,2014,7.1,142829,1.92,Jean-Marc Vallée,"Nick Hornby, Cheryl Strayed","Adventure, Biography, Drama"
2459,Anastasia,1997,7.1,141405,1.57,"Don Bluth, Gary Goldman","Susan Gauthier, Bruce Graham, Bob Tzudiker, Noni White, Eric Tuchman","Adventure, Animation, Drama"
2460,Black Mirror: Bandersnatch,2018,7.1,139704,1.5,David Slade,Charlie Brooker,"Drama, Fantasy, Mystery"
2461,The Host,2006,7.1,138132,2.0,Bong Joon Ho,"Bong Joon Ho, Won-jun Ha, Chul-hyun Baek","Drama, Horror, Sci-Fi"
2462,The Dreamers,2003,7.1,137268,1.92,Bernardo Bertolucci,Gilbert Adair,"Drama, Romance"
2463,T2 Trainspotting,2017,7.1,137006,1.95,Danny Boyle,"John Hodge, Irvine Welsh","Comedy, Crime, Drama"
2464,Booksmart,2019,7.1,136116,1.7,Olivia Wilde,"Emily Halpern, Sarah Haskins, Susanna Fogel, Katie Silberman",Comedy
2465,Carnage,2011,7.1,135673,1.33,Roman Polanski,"Yasmina Reza, Michael Katims, Roman Polanski","Comedy, Drama"
2466,Flags of Our Fathers,2006,7.1,131811,2.25,Clint Eastwood,"William Broyles Jr., Paul Haggis, James Bradley, Ron Powers","Action, Adventure, Drama"
2467,Let Me In,2010,7.1,130248,1.93,Matt Reeves,"Matt Reeves, John Ajvide Lindqvist","Drama, Fantasy, Horror"
2468,Bone Tomahawk,2015,7.1,130019,2.2,S. Craig Zahler,S. Craig Zahler,"Drama, Horror, Western"
2469,The Unforgivable,2021,7.1,123443,1.87,Nora Fingscheidt,"Peter Craig, Hillary Seitz, Courtenay Miles, Sally Wainwright","Crime, Drama, Mystery"
2470,Heathers,1988,7.1,122133,1.72,Michael Lehmann,Daniel Waters,"Comedy, Crime"
2471,The Jacket,2005,7.1,121881,1.72,John Maybury,"Tom Bleecker, Marc Rocco, Massy Tadjedin","Drama, Fantasy, Mystery"
2472,Fast Times at Ridgemont High,1982,7.1,120415,1.5,Amy Heckerling,Cameron Crowe,"Comedy, Drama"
2473,The Aristocats,1970,7.1,119744,1.3,Wolfgang Reitherman,"Larry Clemmons, Vance Gerry, Ken Anderson, Frank Thomas, Eric Cleworth, Julius Svendsen, Ralph Wright, Tom McGowan, Tom Rowe","Adventure, Animation, Comedy"
2474,Gran Turismo,2023,7.1,119598,2.23,Neill Blomkamp,"Jason Hall, Zach Baylin, Alex Tse","Action, Adventure, Drama"
2475,Dogtooth,2009,7.1,116797,1.62,Yorgos Lanthimos,"Efthimis Filippou, Yorgos Lanthimos","Drama, Thriller"
2476,WarGames,1983,7.1,116152,1.9,John Badham,"Lawrence Lasker, Walter F. Parkes","Action, Drama, Sci-Fi"
2477,Uncle Buck,1989,7.1,114017,1.67,John Hughes,John Hughes,Comedy
2478,Runaway Jury,2003,7.1,113715,2.12,Gary Fleder,"John Grisham, Brian Koppelman, David Levien, Rick Cleveland, Matthew Chapman","Crime, Drama, Thriller"
2479,Brick,2005,7.1,112123,1.83,Rian Johnson,Rian Johnson,"Crime, Drama, Mystery"
2480,The Sword in the Stone,1963,7.1,110272,1.32,"Wolfgang Reitherman, Clyde Geronimi, David Hand","Bill Peet, T.H. White","Adventure, Animation, Comedy"
2481,Broken Flowers,2005,7.1,108590,1.77,Jim Jarmusch,"Jim Jarmusch, Bill Raden, Sara Driver","Comedy, Drama, Mystery"
2482,Concussion,2015,7.1,102757,2.05,Peter Landesman,"Peter Landesman, Jeanne Marie Laskas","Biography, Drama, Sport"
2483,West Side Story,2021,7.1,101549,2.6,Steven Spielberg,"Tony Kushner, Arthur Laurents","Crime, Drama, Musical"
2484,Tommy Boy,1995,7.1,101072,1.62,Peter Segal,"Bonnie Turner, Terry Turner","Adventure, Comedy"
2485,Elephant,2003,7.1,100358,1.35,Gus Van Sant,Gus Van Sant,"Crime, Drama, Thriller"
2486,The Girl Who Played with Fire,2009,7.1,100031,2.15,Daniel Alfredson,"Jonas Frykberg, Stieg Larsson","Action, Crime, Drama"
2487,The Frighteners,1996,7.1,98845,1.83,Peter Jackson,"Fran Walsh, Peter Jackson","Comedy, Drama, Fantasy"
2488,The Muppets,2011,7.1,98804,1.72,James Bobin,"Jason Segel, Nicholas Stoller, Jim Henson","Adventure, Comedy, Family"
2489,Audition,1999,7.1,94306,1.92,Takashi Miike,"Ryû Murakami, Daisuke Tengan","Drama, Horror, Mystery"
2490,Half Nelson,2006,7.1,93778,1.77,Ryan Fleck,"Ryan Fleck, Anna Boden",Drama
2491,Cashback,2006,7.1,92835,1.7,Sean Ellis,Sean Ellis,"Comedy, Drama, Romance"
2492,Wag the Dog,1997,7.1,90774,1.62,Barry Levinson,"Larry Beinhart, Hilary Henkin, David Mamet","Comedy, Drama"
2493,Little Shop of Horrors,1986,7.1,90355,1.57,Frank Oz,"Howard Ashman, Roger Corman, Charles B. Griffith","Comedy, Horror, Musical"
2494,Out of Africa,1985,7.1,89324,2.68,Sydney Pollack,"Karen Blixen, Judith Thurman, Errol Trzebinski, Kurt Luedtke","Biography, Drama, Romance"
2495,A Real Pain,2024,7.1,86632,1.5,Jesse Eisenberg,Jesse Eisenberg,"Comedy, Drama"
2496,The Kings of Summer,2013,7.1,85926,1.58,Jordan Vogt-Roberts,Chris Galletta,"Adventure, Comedy, Drama"
2497,The Dig,2021,7.1,85766,1.87,Simon Stone,"Moira Buffini, John Preston","Biography, Drama, History"
2498,Ever After: A Cinderella Story,1998,7.1,83757,2.02,Andy Tennant,"Susannah Grant, Andy Tennant, Rick Parks, Charles Perrault","Drama, Romance"
2499,In the Mouth of Madness,1994,7.1,83618,1.58,John Carpenter,Michael De Luca,"Drama, Fantasy, Horror"
2500,Blue Ruin,2013,7.1,82774,1.5,Jeremy Saulnier,Jeremy Saulnier,"Crime, Drama, Thriller"
2501,Gridiron Gang,2006,7.1,82364,2.08,Phil Joanou,"Jeff Maguire, Jac Flanders","Biography, Crime, Drama"
2502,The Square,2017,7.1,80319,2.52,Ruben Östlund,Ruben Östlund,"Comedy, Drama"
2503,Brawl in Cell Block 99,2017,7.1,80108,2.2,S. Craig Zahler,S. Craig Zahler,"Crime, Drama, Thriller"
2504,Ong-Bak: The Thai Warrior,2003,7.1,79756,1.75,Prachya Pinkaew,"Panna Rittikrai, Prachya Pinkaew, Suphachai Sittiaumponpan","Action, Crime, Thriller"
2505,The King of Staten Island,2020,7.1,79466,2.27,Judd Apatow,"Judd Apatow, Pete Davidson, Dave Sirus","Comedy, Drama"
2506,Whatever Works,2009,7.1,77985,1.55,Woody Allen,Woody Allen,"Comedy, Romance"
2507,Invincible,2006,7.0,77370,1.75,Ericson Core,Brad Gann,"Biography, Drama, Sport"
2508,Day of the Dead,1985,7.1,77029,1.68,George A. Romero,George A. Romero,"Horror, Thriller"
2509,What About Bob?,1991,7.0,76504,1.65,Frank Oz,"Alvin Sargent, Laura Ziskin, Tom Schulman",Comedy
2510,Companion,2025,7.0,76444,1.62,Drew Hancock,Drew Hancock,"Sci-Fi, Thriller"
2511,In the Valley of Elah,2007,7.1,76315,2.02,Paul Haggis,"Paul Haggis, Mark Boal","Crime, Drama, Mystery"
2512,That Thing You Do!,1996,7.0,75994,1.8,Tom Hanks,Tom Hanks,"Comedy, Drama, Music"
2513,The Tinder Swindler,2022,7.1,75547,1.9,Felicity Morris,Felicity Morris,"Crime, Documentary"
2514,District B13,2004,7.1,75536,1.4,Pierre Morel,"Luc Besson, Bibi Naceri","Action, Crime, Sci-Fi"
2515,Werewolf by Night,2022,7.1,74963,0.87,Michael Giacchino,"Heather Quinn, Peter Cameron, Roy Thomas, Jean Thomas, Gerry Conway, Michael G. Ploog","Action, Adventure, Drama"
2516,Re-Animator,1985,7.1,74693,1.4,Stuart Gordon,"H.P. Lovecraft, Dennis Paoli, William Norris, Stuart Gordon","Comedy, Horror, Sci-Fi"
2517,Agora,2009,7.1,74540,2.12,Alejandro Amenábar,"Alejandro Amenábar, Mateo Gil","Adventure, Biography, Drama"
2518,The Dark Crystal,1982,7.1,74336,1.55,"Jim Henson, Frank Oz","David Odell, Jim Henson","Adventure, Family, Fantasy"
2519,Brotherhood of the Wolf,2001,7.0,74235,2.37,Christophe Gans,"Stéphane Cabel, Christophe Gans","Action, Adventure, Drama"
2520,God Bless America,2011,7.1,73035,1.75,Bobcat Goldthwait,Bobcat Goldthwait,"Comedy, Crime, Drama"
2521,Soylent Green,1973,7.0,72879,1.62,Richard Fleischer,"Stanley R. Greenberg, Harry Harrison","Crime, Mystery, Sci-Fi"
2522,Elle,2016,7.1,72849,2.17,Paul Verhoeven,"Philippe Djian, David Birke","Crime, Drama, Thriller"
2523,Timecrimes,2007,7.1,71610,1.53,Nacho Vigalondo,Nacho Vigalondo,"Horror, Mystery, Sci-Fi"
2524,A Tale of Two Sisters,2003,7.1,71050,1.9,Kim Jee-woon,Kim Jee-woon,"Drama, Horror, Mystery"
2525,Arthur Christmas,2011,7.1,70349,1.62,"Sarah Smith, Barry Cook","Peter Baynham, Sarah Smith","Adventure, Animation, Comedy"
2526,Jackass 3D,2010,7.0,69789,1.57,Jeff Tremaine,"Jeff Tremaine, Johnny Knoxville, Bam Margera, Steve-O, Chris Pontius, Ryan Dunn, Jason 'Wee Man' Acuña, Preston Lacy, Ehren McGhehey, Dave England, Spike Jonze, Loomis Fall, Barry Owen Smoler, The Dudesons, Dave Carnie, Mike Kassak, Madison Clapp, Knate Lee, Derek Freda, Trip Taylor, Sean Cliver, Dimitry Elyashkevich, J.P. Blackmon, Rick Kosick","Action, Comedy, Documentary"
2527,Coffee and Cigarettes,2003,7.0,69083,1.58,Jim Jarmusch,Jim Jarmusch,"Comedy, Drama, Music"
2528,Chariots of Fire,1981,7.1,68682,2.08,Hugh Hudson,Colin Welland,"Biography, Drama, Sport"
2529,The Cat Returns,2002,7.1,68544,1.25,Hiroyuki Morita,"Aoi Hiiragi, Hayao Miyazaki, Reiko Yoshida","Adventure, Animation, Comedy"
2530,The Dressmaker,2015,7.0,68518,1.98,Jocelyn Moorhouse,"Rosalie Ham, Jocelyn Moorhouse, P.J. Hogan","Comedy, Drama"
2531,Enough Said,2013,7.0,67850,1.55,Nicole Holofcener,Nicole Holofcener,"Comedy, Drama, Romance"
2532,Leave No Trace,2018,7.1,67767,1.82,Debra Granik,"Debra Granik, Anne Rosellini, Peter Rock","Adventure, Drama"
2533,The White Tiger,2021,7.1,67308,2.08,Ramin Bahrani,"Ramin Bahrani, Aravind Adiga","Crime, Drama"
2534,Missing,2023,7.1,67123,1.85,"Nicholas D. Johnson, Will Merrick","Will Merrick, Nicholas D. Johnson, Sev Ohanian, Aneesh Chaganty","Drama, Mystery, Thriller"
2535,Alive,1993,7.1,66920,2.13,Frank Marshall,"Piers Paul Read, John Patrick Shanley","Biography, Drama, Thriller"
2536,Becoming Jane,2007,7.0,66666,2.0,Julian Jarrold,"Jane Austen, Kevin Hood, Sarah Williams","Biography, Drama, Romance"
2537,Robot & Frank,2012,7.0,66490,1.48,Jake Schreier,Christopher Ford,"Comedy, Crime, Drama"
2538,The Upside,2017,7.0,66483,2.1,Neil Burger,"Jon Hartmere, Éric Toledano, Olivier Nakache","Comedy, Drama"
2539,Kalki 2898 AD,2024,7.0,66346,3.0,Nag Ashwin,Nag Ashwin,"Action, Adventure, Drama"
2540,We Are Marshall,2006,7.1,66288,2.18,McG,"Jamie Linden, Cory Helms","Drama, Sport"
2541,The Jerk,1979,7.1,66245,1.57,Carl Reiner,"Steve Martin, Carl Gottlieb, Michael Elias",Comedy
2542,Don't Look Now,1973,7.1,65978,1.83,Nicolas Roeg,"Daphne Du Maurier, Allan Scott, Chris Bryant","Drama, Horror, Mystery"
2543,Breakdown,1997,7.0,65596,1.55,Jonathan Mostow,"Jonathan Mostow, Sam Montgomery","Action, Crime, Drama"
2544,Perfect Sense,2011,7.0,65514,1.53,David Mackenzie,Kim Fupz Aakeson,"Drama, Romance, Sci-Fi"
2545,An Officer and a Gentleman,1982,7.1,65127,2.07,Taylor Hackford,Douglas Day Stewart,"Drama, Romance"
2546,Everybody's Fine,2009,7.1,64984,1.65,Kirk Jones,"Kirk Jones, Giuseppe Tornatore, Tonino Guerra, Massimo De Rita","Adventure, Drama"
2547,First Reformed,2017,7.1,64831,1.88,Paul Schrader,Paul Schrader,"Drama, Mystery, Thriller"
2548,The Devil's Double,2011,7.0,64622,1.82,Lee Tamahori,"Michael Thomas, Latif Yahia, Emjay Rechsteiner","Biography, Drama, Thriller"
2549,Sneakers,1992,7.1,64451,2.1,Phil Alden Robinson,"Phil Alden Robinson, Lawrence Lasker, Walter F. Parkes","Comedy, Crime, Drama"
2550,Benny & Joon,1993,7.1,63537,1.63,Jeremiah S. Chechik,"Barry Berman, Lesley McNeil","Comedy, Drama, Romance"
2551,Breach,2007,7.0,63040,1.83,Billy Ray,"Adam Mazer, Bill Rotko, Billy Ray","Biography, Crime, Drama"
2552,Ip Man 3,2015,7.0,62292,1.75,Wilson Yip,"Tai-Lee Chan, Lai-Yin Leung, Edmond Wong","Action, Biography, Crime"
2553,The Sea Beast,2022,7.0,61925,1.92,Chris Williams,"Chris Williams, Nell Benjamin, Sam Stratton, Mattson Tomlin","Action, Adventure, Animation"
2554,Bull Durham,1988,7.0,61637,1.8,Ron Shelton,Ron Shelton,"Comedy, Romance, Sport"
2555,Pee-wee's Big Adventure,1985,7.0,60965,1.52,Tim Burton,"Phil Hartman, Paul Reubens, Michael Varhol","Adventure, Comedy, Family"
2556,Don 2,2011,7.1,59746,2.47,Farhan Akhtar,"Farhan Akhtar, Javed Akhtar, Salim Khan, Ameet Mehta, Athar Nawaaz, Rajshri Sudhakar","Action, Crime, Thriller"
2557,Smokey and the Bandit,1977,7.0,59579,1.6,Hal Needham,"Hal Needham, Robert L. Levy, James Lee Barrett, Charles Shyer, Alan Mandel","Action, Adventure, Comedy"
2558,Lords of Dogtown,2005,7.1,59496,1.78,Catherine Hardwicke,Stacy Peralta,"Biography, Drama, Sport"
2559,The Pink Panther,1963,7.0,59092,1.92,Blake Edwards,"Maurice Richlin, Blake Edwards","Comedy, Crime, Romance"
2560,Final Fantasy VII: Advent Children,2005,7.1,58941,1.68,"Tetsuya Nomura, Takeshi Nozue","Kazushige Nojima, Brian Gray, Yoshinori Kitase, Tetsuya Nomura, Hironobu Sakaguchi","Action, Adventure, Animation"
2561,Colonia,2015,7.0,58481,1.83,Florian Gallenberger,"Torsten Wenzel, Florian Gallenberger, Tom Kinninmont","Biography, Drama, History"
2562,The Adventures of Baron Munchausen,1988,7.1,58326,2.1,Terry Gilliam,"Charles McKeown, Terry Gilliam, Gottfried August Bürger, Rudolph Erich Raspe","Adventure, Comedy, Fantasy"
2563,Pieces of a Woman,2020,7.0,58140,2.1,Kornél Mundruczó,Kata Wéber,Drama
2564,The Dirt,2019,7.0,57994,1.78,Jeff Tremaine,"Rich Wilkes, Amanda Adelson, Tommy Lee, Mick Mars, Vince Neil, Nikki Sixx, Neil Strauss","Biography, Comedy, Drama"
2565,Boiler Room,2000,7.0,57848,2.0,Ben Younger,Ben Younger,"Crime, Drama, Thriller"
2566,Can You Ever Forgive Me?,2018,7.1,57553,1.77,Marielle Heller,"Nicole Holofcener, Jeff Whitty","Biography, Comedy, Crime"
2567,Parenthood,1989,7.1,56719,2.07,Ron Howard,"Lowell Ganz, Babaloo Mandel, Ron Howard","Comedy, Drama"
2568,Hard Eight,1996,7.1,56673,1.68,Paul Thomas Anderson,Paul Thomas Anderson,"Crime, Drama"
