puesto,titulo,año,puntuacion,votos,duracion_horas,directores,escritores,generos
3457,The Idiots,1998,6.7,34980,1.95,Lars von Trier,Lars von Trier,"Comedy, Drama"
3458,Celeste & Jesse Forever,2012,6.6,34625,1.53,Lee Toland Krieger,"Rashida Jones, Will McCormack","Comedy, Drama, Romance"
3459,Slumberland,2022,6.7,34540,1.95,Francis Lawrence,"David Guion, Michael Handelman","Adventure, Comedy, Drama"
3460,Metal Lords,2022,6.7,34534,1.62,Peter Sollett,D.B. Weiss,"Comedy, Music"
3461,The Immigrant,2013,6.6,34527,2.0,James Gray,"James Gray, Ric Menello","Drama, Romance"
3462,Victory,1981,6.7,34456,1.93,John Huston,"Yabo Yablonsky, Djordje Milicevic, Jeff Maguire, Evan Jones","Drama, Sport, War"
3463,Cronos,1992,6.7,34451,1.57,Guillermo del Toro,Guillermo del Toro,"Drama, Fantasy, Horror"
3464,The Shipping News,2001,6.7,34341,1.85,Lasse Hallström,"Annie Proulx, Robert Nelson Jacobs",Drama
3465,Shattered,2007,6.6,34323,1.58,Mike Barker,William Morrissey,"Crime, Drama, Thriller"
3466,"Men, Women & Children",2014,6.6,34294,1.98,Jason Reitman,"Chad Kultgen, Jason Reitman, Erin Cressida Wilson","Comedy, Drama"
3467,Chaos Theory,2007,6.6,34287,1.45,Marcos Siega,Daniel Taplitz,"Comedy, Drama, Romance"
3468,Singles,1992,6.7,33977,1.65,Cameron Crowe,Cameron Crowe,"Comedy, Drama, Music"
3469,Rare Exports,2010,6.6,33861,1.4,Jalmari Helander,"Jalmari Helander, Juuso Helander, Petri Jokiranta, Sami Parkkinen","Adventure, Fantasy, Horror"
3470,Hysteria,2011,6.7,33709,1.67,Tanya Wexler,"Stephen Dyer, Jonah Lisa Dyer, Howard Gensler","Biography, Comedy, Romance"
3471,The Football Factory,2004,6.7,33689,1.52,Nick Love,"John King, Nick Love","Crime, Drama, Sport"
3472,Powder,1995,6.6,33659,1.85,Victor Salva,Victor Salva,"Drama, Fantasy, Mystery"
3473,The Red Sea Diving Resort,2019,6.6,33658,2.15,Gideon Raff,Gideon Raff,"Drama, History, Thriller"
3474,Outland,1981,6.6,33613,1.82,Peter Hyams,Peter Hyams,"Action, Crime, Sci-Fi"
3475,In a World...,2013,6.6,33413,1.55,Lake Bell,Lake Bell,Comedy
3476,The Lady in the Van,2015,6.7,33389,1.73,Nicholas Hytner,Alan Bennett,"Biography, Comedy, Drama"
3477,Harriet,2019,6.7,33285,2.08,Kasi Lemmons,"Gregory Allen Howard, Kasi Lemmons","Action, Biography, Drama"
3478,From Beyond,1986,6.6,33128,1.42,Stuart Gordon,"H.P. Lovecraft, Brian Yuzna, Dennis Paoli, Stuart Gordon","Horror, Sci-Fi"
3479,Psycho II,1983,6.6,33120,1.88,Richard Franklin,"Tom Holland, Robert Bloch","Crime, Horror, Mystery"
3480,Spring,2014,6.7,32702,1.82,"Justin Benson, Aaron Moorhead",Justin Benson,"Drama, Horror, Romance"
3481,Silent Running,1972,6.6,32576,1.48,Douglas Trumbull,"Deric Washburn, Michael Cimino, Steven Bochco","Drama, Sci-Fi"
3482,House on Haunted Hill,1959,6.7,32574,1.25,William Castle,Robb White,"Crime, Horror, Mystery"
3483,Cypher,2002,6.7,32499,1.58,Vincenzo Natali,Brian King,"Mystery, Sci-Fi, Thriller"
3484,Son of Batman,2014,6.7,32471,1.23,Ethan Spaulding,"Bob Kane, Grant Morrison, Andy Kubert, James Robinson, Joe R. Lansdale, Marv Wolfman, George Pérez, Gerry Conway, Don Newton","Action, Adventure, Animation"
3485,Paranoid Park,2007,6.6,32386,1.42,Gus Van Sant,"Gus Van Sant, Blake Nelson","Crime, Drama, Mystery"
3486,Two Days in Paris,2007,6.7,32350,1.6,Julie Delpy,Julie Delpy,"Comedy, Drama, Romance"
3487,Return to Oz,1985,6.7,32323,1.88,Walter Murch,"Walter Murch, Gill Dennis, L. Frank Baum","Adventure, Family, Fantasy"
3488,The Mosquito Coast,1986,6.6,32307,1.95,Peter Weir,"Paul Theroux, Paul Schrader","Adventure, Drama, Thriller"
3489,Big Nothing,2006,6.7,32301,1.43,Jean-Baptiste Andrea,"Jean-Baptiste Andrea, William Rosenfeld","Comedy, Crime, Thriller"
3490,The Man Without a Face,1993,6.7,32043,1.92,Mel Gibson,"Isabelle Holland, Malcolm MacRury",Drama
3491,Clouds of Sils Maria,2014,6.7,31915,2.07,Olivier Assayas,Olivier Assayas,Drama
3492,Heavyweights,1995,6.6,31907,1.62,Steven Brill,"Judd Apatow, Steven Brill","Comedy, Drama, Family"
3493,A Civil Action,1998,6.6,31814,1.92,Steven Zaillian,"Jonathan Harr, Steven Zaillian","Biography, Drama"
3494,Phenomena,1985,6.7,31560,1.93,Dario Argento,"Dario Argento, Franco Ferrini","Crime, Horror, Mystery"
3495,Stir Crazy,1980,6.7,31492,1.85,Sidney Poitier,"Bruce Jay Friedman, Charles Blackwell","Comedy, Crime"
3496,Colors,1988,6.7,31341,2.0,Dennis Hopper,"Michael Schiffer, Richard Di Lello","Action, Crime, Drama"
3497,Dhoom 2,2006,6.6,31296,2.53,Sanjay Gadhvi,"Vijay Krishna Acharya, Aditya Chopra","Action, Crime, Thriller"
3498,Satyaprem Ki Katha,2023,6.7,31134,2.43,Sameer Vidwans,Karan Shrikant Sharma,"Comedy, Drama, Musical"
3499,Marvin's Room,1996,6.7,30944,1.63,Jerry Zaks,Scott McPherson,Drama
3500,Around the World in 80 Days,1956,6.7,30823,2.92,"Michael Anderson, John Farrow","James Poe, John Farrow, S.J. Perelman, Jules Verne","Adventure, Comedy, Family"
3501,Happythankyoumoreplease,2010,6.7,30784,1.67,Josh Radnor,Josh Radnor,"Comedy, Drama, Romance"
3502,Primary Colors,1998,6.7,30775,2.38,Mike Nichols,"Joe Klein, Elaine May","Comedy, Drama"
3503,Grumpier Old Men,1995,6.7,30707,1.68,Howard Deutch,Mark Steven Johnson,"Comedy, Romance"
3504,Fido,2006,6.7,30630,1.55,Andrew Currie,"Robert Chomiak, Andrew Currie, Dennis Heaton","Comedy, Drama, Horror"
3505,Torn Curtain,1966,6.6,30562,2.13,Alfred Hitchcock,"Brian Moore, Willis Hall, Keith Waterhouse","Drama, Romance, Thriller"
3506,The Eye,2002,6.6,30538,1.65,"Danny Pang, Oxide Chun Pang","Yuet-Jan Hui, Danny Pang, Oxide Chun Pang","Horror, Mystery, Thriller"
3507,Devotion,2022,6.6,30536,2.32,J.D. Dillard,"Jake Crane, Jonathan Stewart, Adam Makos","Action, Biography, Drama"
3508,Things to Do in Denver When You're Dead,1995,6.7,30531,1.92,Gary Fleder,Scott Rosenberg,"Crime, Drama, Thriller"
3509,Turbo Kid,2015,6.7,30453,1.55,"François Simard, Anouk Whissell, Yoann-Karl Whissell","Anouk Whissell, François Simard, Yoann-Karl Whissell","Action, Adventure, Comedy"
3510,Taking Woodstock,2009,6.7,30361,2.0,Ang Lee,"James Schamus, Elliot Tiber, Tom Monte","Biography, Comedy, Drama"
3511,The Hunger,1983,6.6,30334,1.62,Tony Scott,"James Costigan, Michael Thomas, Whitley Strieber","Drama, Horror"
3512,The Book of Henry,2017,6.6,30066,1.75,Colin Trevorrow,Gregg Hurwitz,"Crime, Drama, Thriller"
3513,Three Steps Above Heaven,2010,6.7,30007,1.97,Fernando González Molina,"Federico Moccia, Ramón Salazar","Action, Drama, Romance"
3514,The Man Who Fell to Earth,1976,6.6,29938,2.32,Nicolas Roeg,"Paul Mayersberg, Walter Tevis","Drama, Sci-Fi"
3515,The Perfect Host,2010,6.7,29877,1.55,Nicholas Tomnay,"Nicholas Tomnay, Krishna Jones","Comedy, Crime, Thriller"
3516,Missing Link,2019,6.7,29772,1.55,Chris Butler,Chris Butler,"Adventure, Animation, Comedy"
3517,Moxie,2021,6.7,29736,1.85,Amy Poehler,"Jennifer Mathieu, Tamara Chestna, Dylan Meyer","Comedy, Drama"
3518,Mr. Mom,1983,6.6,29505,1.52,Stan Dragoti,John Hughes,"Comedy, Drama"
3519,Stakeout,1987,6.7,29408,1.95,John Badham,Jim Kouf,"Action, Comedy, Crime"
3520,The Jane Austen Book Club,2007,6.7,29400,1.77,Robin Swicord,"Robin Swicord, Karen Joy Fowler","Comedy, Drama, Romance"
3521,A Boy Called Christmas,2021,6.7,29383,1.77,Gil Kenan,"Ol Parker, Gil Kenan, Matt Haig, Surbhi Sehgal","Adventure, Drama, Family"
3522,Mistress America,2015,6.7,29231,1.4,Noah Baumbach,"Noah Baumbach, Greta Gerwig","Comedy, Drama"
3523,Max,2015,6.6,29054,1.85,Boaz Yakin,"Boaz Yakin, Sheldon Lettich","Adventure, Drama, Family"
3524,"Mystery, Alaska",1999,6.7,29021,1.98,Jay Roach,"David E. Kelley, Sean O'Byrne","Comedy, Drama, Sport"
3525,Hamburger Hill,1987,6.7,28940,1.83,John Irvin,James Carabatsos,"Action, Drama, Thriller"
3526,Your Sister's Sister,2011,6.7,28832,1.5,Lynn Shelton,Lynn Shelton,"Comedy, Drama, Romance"
3527,A Mighty Heart,2007,6.6,28499,1.8,Michael Winterbottom,"John Orloff, Mariane Pearl","Biography, Drama, History"
3528,The Quiet Earth,1985,6.7,28464,1.52,Geoff Murphy,"Craig Harrison, Bill Baer, Bruno Lawrence, Sam Pillsbury","Drama, Mystery, Sci-Fi"
3529,The Stranger,2022,6.6,28462,1.95,Thomas M. Wright,"Thomas M. Wright, Kate Kyriacou","Crime, Drama, Thriller"
3530,The Final Countdown,1980,6.7,28409,1.72,Don Taylor,"Thomas Hunter, Peter Powell, David Ambrose, Gerry Davis","Action, Adventure, Sci-Fi"
3531,Demons,1985,6.6,28253,1.47,Lamberto Bava,"Dardano Sacchetti, Dario Argento, Lamberto Bava, Franco Ferrini",Horror
3532,The Disappearance of Alice Creed,2009,6.7,28042,1.67,J Blakeson,J Blakeson,"Crime, Thriller"
3533,Heartbreaker,2010,6.7,28033,1.75,Pascal Chaumeil,"Laurent Zeitoun, Jeremy Doner, Yoann Gromb","Comedy, Romance"
3534,Benedetta,2021,6.7,27699,2.18,Paul Verhoeven,"David Birke, Paul Verhoeven, Judith C. Brown, Pascal Bonitzer, Gerard Soeteman","Biography, Drama, Romance"
3535,Bhediya,2022,6.7,27671,2.6,Amar Kaushik,Niren Bhatt,"Comedy, Horror, Thriller"
3536,Bhoot Police,2021,6.7,27659,2.15,Pavan Kirpalani,"Pavan Kirpalani, Pooja Ladha Surti, Sumit Batheja, Anuvab Pal, Devashish Makhija","Comedy, Horror"
3537,Prizzi's Honor,1985,6.7,27590,2.17,John Huston,"Richard Condon, Janet Roach","Comedy, Crime, Drama"
3538,Night of the Creeps,1986,6.7,27492,1.47,Fred Dekker,Fred Dekker,"Comedy, Horror, Sci-Fi"
3539,Flawless,2007,6.7,27377,1.8,Michael Radford,Edward Anderson,"Crime, Drama, Thriller"
3540,Tales from the Crypt: Demon Knight,1995,6.7,27232,1.53,Ernest R. Dickerson,"Ethan Reiff, Cyrus Voris, Mark Bishop","Action, Fantasy, Horror"
3541,Colette,2018,6.7,27232,1.85,Wash Westmoreland,"Richard Glatzer, Wash Westmoreland, Rebecca Lenkiewicz","Biography, Drama, History"
3542,Take the Lead,2006,6.6,27060,1.97,Liz Friedlander,Dianne Houston,"Drama, Music"
3543,Wanted,2009,6.6,27004,2.45,Prabhu Deva,"Sunil Kumar Agrawal, Shabbir Ahmed, Shiraz Ahmed, Wajid Ali, Arun Bhairav, Puri Jagannadh, Rebel Ravi, Jalees Sherwani","Action, Thriller"
3544,Eagle vs Shark,2007,6.7,26880,1.47,Taika Waititi,"Loren Taylor, Taika Waititi","Comedy, Romance"
3545,The Miseducation of Cameron Post,2018,6.6,26709,1.52,Desiree Akhavan,"Desiree Akhavan, Cecilia Frugiuele, Emily M. Danforth","Comedy, Drama"
3546,The Postman Always Rings Twice,1981,6.6,26704,2.03,Bob Rafelson,"David Mamet, James M. Cain","Crime, Drama, Romance"
3547,Obvious Child,2014,6.7,26659,1.4,Gillian Robespierre,"Gillian Robespierre, Karen Maine, Elisabeth Holm, Anna Bean","Comedy, Drama, Romance"
3548,The Beyond,1981,6.6,26542,1.45,Lucio Fulci,"Dardano Sacchetti, Giorgio Mariuzzo, Lucio Fulci, H.P. Lovecraft, Clark Ashton Smith",Horror
3549,White Squall,1996,6.6,26375,2.15,Ridley Scott,"Charles Gieg Jr., Felix Sutton, Todd Robinson","Adventure, Drama"
3550,Super Dark Times,2017,6.6,26347,1.72,Kevin Phillips,"Ben Collins, Luke Piotrowski","Crime, Drama, Thriller"
3551,Behind the Mask: The Rise of Leslie Vernon,2006,6.7,26313,1.53,Scott Glosserman,"Scott Glosserman, David J. Stieve","Comedy, Horror, Thriller"
3552,Toy Soldiers,1991,6.6,26208,1.85,Daniel Petrie Jr.,"William P. Kennedy, Daniel Petrie Jr., David Koepp","Action, Drama, Thriller"
3553,Reality,2023,6.7,26194,1.38,Tina Satter,"Tina Satter, James Paul Dallas",Drama
3554,The Six Triple Eight,2024,6.7,26140,2.12,Tyler Perry,"Kevin Hymel, Tyler Perry","Drama, History, War"
3555,One Eight Seven,1997,6.6,26108,1.98,Kevin Reynolds,Scott Yagemann,"Drama, Thriller"
3556,Tuck Everlasting,2002,6.6,26054,1.5,Jay Russell,"Natalie Babbitt, Jeffrey Lieber, James V. Hart","Drama, Family, Fantasy"
3557,Empire of Light,2022,6.7,26023,1.92,Sam Mendes,Sam Mendes,"Drama, Romance"
3558,Bigil,2019,6.7,26018,2.98,Atlee,"Atlee, Ramanagirivasan, Shanoor Mirza","Action, Drama, Sport"
3559,Albert Nobbs,2011,6.7,26006,1.88,Rodrigo García,"Gabriella Prekop, John Banville, Glenn Close, George Moore, István Szabó","Drama, Romance"
3560,Buffalo Soldiers,2001,6.7,25968,1.63,Gregor Jordan,"Robert O'Connor, Gregor Jordan, Eric Weiss, Nora Maccoby","Comedy, Crime, Drama"
3561,Starter for 10,2006,6.7,25943,1.53,Tom Vaughan,David Nicholls,"Comedy, Drama, Romance"
3562,Streets of Fire,1984,6.7,25914,1.55,Walter Hill,"Walter Hill, Larry Gross","Action, Crime, Drama"
3563,Reservation Road,2007,6.6,25555,1.7,Terry George,"John Burnham Schwartz, Terry George","Crime, Drama, Thriller"
3564,Whitney Houston: I Wanna Dance with Somebody,2022,6.6,25538,2.4,Kasi Lemmons,Anthony McCarten,"Biography, Drama, Music"
3565,Fame,1980,6.6,25509,2.23,Alan Parker,Christopher Gore,"Drama, Music, Musical"
3566,"Juliet, Naked",2018,6.6,25471,1.62,Jesse Peretz,"Evgenia Peretz, Jim Taylor, Tamara Jenkins, Nick Hornby","Comedy, Drama, Music"
3567,Hoffa,1992,6.6,25420,2.33,Danny DeVito,David Mamet,"Biography, Crime, Drama"
3568,Gigi,1958,6.6,25385,1.92,"Vincente Minnelli, Charles Walters","Alan Jay Lerner, Colette, Niven Busch","Comedy, Musical, Romance"
3569,Brain on Fire,2016,6.6,25307,1.47,Gerard Barrett,"Gerard Barrett, Susannah Cahalan","Biography, Drama"
3570,Purple Rain,1984,6.5,25273,1.85,Albert Magnoli,"Albert Magnoli, William Blinn","Drama, Music, Romance"
3571,Lady Chatterley's Lover,2022,6.6,25224,2.1,Laure de Clermont-Tonnerre,"David Magee, D.H. Lawrence","Drama, Romance"
3572,Inferno,1980,6.5,25181,1.77,Dario Argento,"Dario Argento, Dardano Sacchetti, Thomas De Quincey, Daria Nicolodi",Horror
3573,Ammonite,2020,6.5,25150,1.95,Francis Lee,Francis Lee,"Drama, History, Romance"
3574,Causeway,2022,6.6,25028,1.57,Lila Neugebauer,"Ottessa Moshfegh, Luke Goebel, Elizabeth Sanders",Drama
3575,Captain Marvel,2019,6.8,634851,2.05,"Anna Boden, Ryan Fleck","Anna Boden, Ryan Fleck, Geneva Robertson-Dworet, Nicole Perlman, Meg LeFauve","Action, Adventure, Sci-Fi"
3576,Barbie,2023,6.8,603844,1.9,Greta Gerwig,"Greta Gerwig, Noah Baumbach","Adventure, Comedy, Fantasy"
3577,Aquaman,2018,6.8,536627,2.38,James Wan,"David Leslie Johnson-McGoldrick, Will Beall, Geoff Johns, James Wan, Paul Norris, Mort Weisinger","Action, Adventure, Fantasy"
3578,The Maze Runner,2014,6.8,533960,1.88,Wes Ball,"Noah Oppenheim, Grant Pierce Myers, T.S. Nowlin, James Dashner","Action, Mystery, Sci-Fi"
3579,Spectre,2015,6.8,479653,2.47,Sam Mendes,"John Logan, Neal Purvis, Robert Wade, Jez Butterworth, Ian Fleming","Action, Adventure, Thriller"
3580,X-Men: Apocalypse,2016,6.8,477934,2.4,Bryan Singer,"Simon Kinberg, Bryan Singer, Michael Dougherty, Dan Harris, Jack Kirby, Stan Lee","Action, Adventure, Sci-Fi"
3581,Bruce Almighty,2003,6.8,451434,1.68,Tom Shadyac,"Steve Koren, Mark O'Keefe, Steve Oedekerk","Comedy, Fantasy"
3582,The Fast and the Furious,2001,6.8,436588,1.77,Rob Cohen,"Ken Li, Gary Scott Thompson, Erik Bergquist, David Ayer","Action, Crime, Thriller"
3583,Signs,2002,6.8,400449,1.77,M. Night Shyamalan,M. Night Shyamalan,"Drama, Mystery, Sci-Fi"
3584,Men in Black³,2012,6.8,399848,1.77,Barry Sonnenfeld,"Etan Cohen, Lowell Cunningham","Action, Adventure, Comedy"
3585,50 First Dates,2004,6.8,397401,1.65,Peter Segal,George Wing,"Comedy, Drama, Romance"
3586,Yes Man,2008,6.8,394005,1.73,Peyton Reed,"Nicholas Stoller, Jarrad Paul, Andrew Mogel, Danny Wallace","Comedy, Romance"
3587,The Proposal,2009,6.8,379520,1.8,Anne Fletcher,Peter Chiarelli,"Comedy, Drama, Romance"
3588,Annihilation,2018,6.8,378148,1.92,Alex Garland,"Alex Garland, Jeff VanderMeer","Adventure, Drama, Horror"
3589,Tron: Legacy,2010,6.8,365626,2.08,Joseph Kosinski,"Edward Kitsis, Adam Horowitz, Brian Klugman, Lee Sternthal, Steven Lisberger, Bonnie MacBird","Action, Adventure, Sci-Fi"
3590,Us,2019,6.8,364614,1.93,Jordan Peele,Jordan Peele,"Horror, Mystery, Thriller"
3591,Insidious,2010,6.8,352127,1.72,James Wan,Leigh Whannell,"Horror, Mystery, Thriller"
3592,The Book of Eli,2010,6.8,350613,1.97,"Albert Hughes, Allen Hughes",Gary Whitta,"Action, Adventure, Drama"
3593,The Island,2005,6.8,333892,2.27,Michael Bay,"Caspian Tredwell-Owen, Alex Kurtzman, Roberto Orci","Action, Sci-Fi, Thriller"
3594,The Transporter,2002,6.8,329613,1.53,"Louis Leterrier, Corey Yuen","Luc Besson, Robert Mark Kamen","Action, Crime, Thriller"
3595,Contagion,2011,6.8,323612,1.77,Steven Soderbergh,Scott Z. Burns,"Drama, Thriller"
3596,Bridesmaids,2011,6.8,316433,2.08,Paul Feig,"Kristen Wiig, Annie Mumolo",Comedy
3597,Ice Age: The Meltdown,2006,6.8,307040,1.52,Carlos Saldanha,"Peter Gaulke, Gerry Swallow, Jim Hecht, Michael J. Wilson","Adventure, Animation, Comedy"
3598,Panic Room,2002,6.8,306371,1.87,David Fincher,David Koepp,"Crime, Drama, Thriller"
3599,Bad Boys,1995,6.8,304876,1.98,Michael Bay,"George Gallo, Michael Barrie, Jim Mulholland, Doug Richardson","Action, Comedy, Crime"
3600,1408,2007,6.8,303882,1.73,Mikael Håfström,"Matt Greenberg, Scott Alexander, Larry Karaszewski, Stephen King","Fantasy, Horror, Mystery"
3601,Hannibal,2001,6.8,303726,2.18,Ridley Scott,"Thomas Harris, David Mamet, Steven Zaillian","Crime, Drama, Thriller"
3602,Sinister,2012,6.8,298202,1.83,Scott Derrickson,"Scott Derrickson, C. Robert Cargill","Horror, Mystery, Thriller"
3603,Nope,2022,6.8,297418,2.17,Jordan Peele,Jordan Peele,"Horror, Mystery, Sci-Fi"
3604,It Follows,2014,6.8,285948,1.67,David Robert Mitchell,David Robert Mitchell,"Horror, Mystery, Thriller"
3605,The Lion King,2019,6.8,282294,1.97,Jon Favreau,"Jeff Nathanson, Irene Mecchi, Jonathan Roberts, Linda Woolverton","Adventure, Animation, Drama"
3606,Hook,1991,6.8,281820,2.37,Steven Spielberg,"J.M. Barrie, James V. Hart, Nick Castle, Malia Scotch Marmo","Adventure, Comedy, Family"
3607,Bridget Jones's Diary,2001,6.8,277356,1.62,Sharon Maguire,"Helen Fielding, Andrew Davies, Richard Curtis","Comedy, Drama, Romance"
3608,Chappie,2015,6.8,277277,2.0,Neill Blomkamp,"Neill Blomkamp, Terri Tatchell","Action, Crime, Drama"
3609,Extraction,2020,6.8,277078,1.93,Sam Hargrave,"Joe Russo, Ande Parks, Anthony Russo, Fernando León González","Action, Crime, Thriller"
3610,21,2008,6.8,273485,2.05,Robert Luketic,"Peter Steinfeld, Allan Loeb, Ben Mezrich","Crime, Drama, Thriller"
3611,Unknown,2011,6.8,272954,1.88,Jaume Collet-Serra,"Oliver Butcher, Stephen Cornwell, Didier Van Cauwelaert","Action, Mystery, Thriller"
3612,Disturbia,2007,6.8,264501,1.75,D.J. Caruso,"Christopher Landon, Carl Ellsworth","Crime, Drama, Mystery"
3613,The Babadook,2014,6.8,260002,1.57,Jennifer Kent,Jennifer Kent,"Drama, Horror, Mystery"
3614,Ghostbusters,2016,6.8,252843,1.95,Paul Feig,"Katie Dippold, Paul Feig, Ivan Reitman, Dan Aykroyd, Harold Ramis","Action, Comedy, Fantasy"
3615,Warm Bodies,2013,6.8,249604,1.63,Jonathan Levine,"Isaac Marion, Jonathan Levine","Comedy, Horror, Romance"
3616,Role Models,2008,6.8,245365,1.65,David Wain,"Timothy Dowling, William Blake Herron, Paul Rudd, David Wain, Ken Marino",Comedy
3617,Bolt,2008,6.8,238257,1.6,"Byron Howard, Chris Williams","Dan Fogelman, Chris Williams","Adventure, Animation, Comedy"
3618,Mad Max,1979,6.8,237868,1.47,George Miller,"James McCausland, George Miller, Byron Kennedy","Action, Adventure, Sci-Fi"
3619,A Series of Unfortunate Events,2004,6.8,226103,1.8,Brad Silberling,"Robert Gordon, Daniel Handler","Adventure, Comedy, Family"
3620,Gangster Squad,2013,6.7,225939,1.88,Ruben Fleischer,"Will Beall, Paul Lieberman","Action, Crime, Drama"
3621,The Fall Guy,2024,6.8,219642,2.1,David Leitch,"Glen A. Larson, Drew Pearce","Action, Comedy, Drama"
3622,Rocky III,1982,6.8,218982,1.65,Sylvester Stallone,Sylvester Stallone,"Drama, Sport"
3623,Zombieland: Double Tap,2019,6.7,214792,1.65,Ruben Fleischer,"Rhett Reese, Paul Wernick, Dave Callaham","Action, Comedy, Horror"
3624,The Equalizer 2,2018,6.7,214042,2.02,Antoine Fuqua,"Richard Wenk, Michael Sloan, Richard Lindheim","Action, Crime, Mystery"
3625,Atomic Blonde,2017,6.7,213730,1.92,David Leitch,"Kurt Johnstad, Antony Johnston, Sam Hart","Action, Thriller"
3626,Underworld: Evolution,2006,6.7,213672,1.77,Len Wiseman,"Danny McBride, Len Wiseman, Kevin Grevioux","Action, Fantasy, Thriller"
3627,Unstoppable,2010,6.8,213361,1.63,Tony Scott,Mark Bomback,"Action, Thriller"
3628,Cruel Intentions,1999,6.8,213313,1.62,Roger Kumble,"Choderlos de Laclos, Roger Kumble","Drama, Romance"
3629,Ready or Not,2019,6.8,213186,1.58,"Matt Bettinelli-Olpin, Tyler Gillett","Guy Busick, R. Christopher Murphy","Action, Comedy, Horror"
3630,The Hitchhiker's Guide to the Galaxy,2005,6.7,212448,1.82,Garth Jennings,"Douglas Adams, Karey Kirkpatrick","Adventure, Comedy, Sci-Fi"
3631,Hanna,2011,6.7,210712,1.85,Joe Wright,"Seth Lochhead, David Farr","Action, Adventure, Drama"
3632,Pocahontas,1995,6.7,210190,1.35,"Mike Gabriel, Eric Goldberg","Carl Binder, Susannah Grant, Philip LaZebnik, Glen Keane, Joe Grant, Ralph Zondag, Burny Mattinson, Ed Gombert, Kaan Kalyon, Francis Glebas, Rob Gibbs, Bruce Morris, Todd Kurosawa, Duncan Marjoribanks, Chris Buck, Andrew Chapman, Randy Cartwright, Will Finn, Broose Johnson, T. Daniel Hofstedt, David Pruiksma, Nik Ranieri, Vincent DeFrances, Tom Mazzocco, Don Dougherty, Jorgen Klubien, Mike Gabriel","Adventure, Animation, Drama"
3633,The Killer,2023,6.7,209843,1.97,David Fincher,"Alexis Nolent, Luc Jacamon, Andrew Kevin Walker","Action, Adventure, Crime"
3634,The Vow,2012,6.8,209464,1.73,Michael Sucsy,"Abby Kohn, Marc Silverstein, Jason Katims, Stuart Sender","Drama, Romance"
3635,Madagascar 3: Europe's Most Wanted,2012,6.8,207248,1.55,"Eric Darnell, Tom McGrath, Conrad Vernon","Eric Darnell, Noah Baumbach, Alejandro Bien-Willner","Adventure, Animation, Comedy"
3636,Frozen II,2019,6.8,206719,1.72,"Chris Buck, Jennifer Lee","Jennifer Lee, Hans Christian Andersen, Chris Buck, Marc Smith, Kristen Anderson-Lopez, Robert Lopez, Allison Schroeder","Adventure, Animation, Comedy"
3637,The Ninth Gate,1999,6.7,204019,2.22,Roman Polanski,"Arturo Pérez-Reverte, John Brownjohn, Enrique Urbizu, Roman Polanski","Mystery, Thriller"
3638,The Mask of Zorro,1998,6.8,203644,2.27,Martin Campbell,"Johnston McCulley, Ted Elliott, Terry Rossio, Randall Jahnson, John Eskow","Action, Adventure, Comedy"
3639,Demolition Man,1993,6.7,201881,1.92,Marco Brambilla,"Peter M. Lenkov, Robert Reneau, Daniel Waters","Action, Sci-Fi, Thriller"
3640,Miss Peregrine's Home for Peculiar Children,2016,6.7,200616,2.12,Tim Burton,"Ransom Riggs, Jane Goldman","Adventure, Drama, Family"
3641,The Power of the Dog,2021,6.8,199890,2.1,Jane Campion,"Jane Campion, Thomas Savage","Drama, Western"
3642,Bumblebee,2018,6.7,198317,1.9,Travis Knight,Christina Hodson,"Action, Adventure, Sci-Fi"
3643,Sleepless in Seattle,1993,6.8,198200,1.75,Nora Ephron,"Jeff Arch, Nora Ephron, David S. Ward","Comedy, Drama, Romance"
3644,Black Mass,2015,6.8,197747,2.05,Scott Cooper,"Mark Mallouk, Jez Butterworth, Dick Lehr, Gerard O'Neill","Biography, Crime, Drama"
3645,Over the Hedge,2006,6.7,195886,1.38,"Tim Johnson, Karey Kirkpatrick","Len Blum, Lorne Cameron, David Hoselton, Karey Kirkpatrick, Michael Fry, T. Lewis, Chris Poche, Eric Forsberg, Mike de Seve","Adventure, Animation, Comedy"
3646,The Bone Collector,1999,6.7,193069,1.97,Phillip Noyce,"Jeffery Deaver, Jeremy Iacone","Crime, Drama, Mystery"
3647,The Old Guard,2020,6.7,191585,2.08,Gina Prince-Bythewood,"Greg Rucka, Leandro Fernandez","Action, Thriller"
3648,The Tree of Life,2011,6.8,187811,2.32,Terrence Malick,Terrence Malick,"Drama, Fantasy"
3649,The Creator,2023,6.7,184714,2.22,Gareth Edwards,"Gareth Edwards, Chris Weitz","Action, Adventure, Drama"
3650,Lethal Weapon 3,1992,6.7,183584,1.97,Richard Donner,"Jeffrey Boam, Robert Mark Kamen, Shane Black","Action, Crime, Thriller"
3651,Commando,1985,6.7,181191,1.5,Mark L. Lester,"Jeph Loeb, Matthew Weisman, Steven E. de Souza","Action, Adventure, Thriller"
3652,From Hell,2001,6.7,168098,2.03,"Albert Hughes, Allen Hughes","Alan Moore, Eddie Campbell, Terry Hayes, Rafael Yglesias","Crime, Horror, Mystery"
3653,Analyze This,1999,6.7,165047,1.72,Harold Ramis,"Kenneth Lonergan, Peter Tolan, Harold Ramis","Comedy, Crime"
3654,The Parent Trap,1998,6.7,163693,2.13,Nancy Meyers,"Erich Kästner, David Swift, Nancy Meyers, Charles Shyer","Adventure, Comedy, Drama"
3655,Pandorum,2009,6.7,163631,1.8,Christian Alvart,"Travis Milloy, Christian Alvart","Action, Horror, Mystery"
3656,The Hunger Games: The Ballad of Songbirds & Snakes,2023,6.7,158500,2.62,Francis Lawrence,"Michael Lesslie, Michael Arndt, Suzanne Collins","Action, Adventure, Drama"
3657,Monster House,2006,6.7,146457,1.52,Gil Kenan,"Dan Harmon, Rob Schrab, Pamela Pettler","Animation, Comedy, Family"
3658,Beetlejuice Beetlejuice,2024,6.7,146425,1.75,Tim Burton,"Michael McDowell, Larry Wilson, Alfred Gough, Miles Millar, Seth Grahame-Smith","Comedy, Fantasy, Horror"
3659,The Rundown,2003,6.7,146234,1.73,Peter Berg,"R.J. Stewart, James Vanderbilt","Action, Adventure, Comedy"
3660,The Exorcism of Emily Rose,2005,6.7,144589,1.98,Scott Derrickson,"Paul Harris Boardman, Scott Derrickson","Drama, Horror, Thriller"
3661,Police Academy,1984,6.7,143381,1.6,Hugh Wilson,"Neal Israel, Pat Proft, Hugh Wilson, Paul Maslansky",Comedy
3662,Hairspray,2007,6.7,142235,1.95,Adam Shankman,"Leslie Dixon, John Waters, Mark O'Donnell, Thomas Meehan","Comedy, Drama, Musical"
3663,Death Becomes Her,1992,6.7,141331,1.73,Robert Zemeckis,"Martin Donovan, David Koepp","Comedy, Fantasy, Horror"
3664,Robin Hood: Men in Tights,1993,6.7,141235,1.73,Mel Brooks,"J.D. Shapiro, Evan Chandler, Mel Brooks","Adventure, Comedy, Musical"
3665,Ransom,1996,6.7,139368,2.02,Ron Howard,"Cyril Hume, Richard Maibaum, Richard Price, Alexander Ignon","Action, Crime, Drama"
3666,Cars 3,2017,6.7,135309,1.7,Brian Fee,"Brian Fee, Ben Queen, Eyal Podell, Jonathon E. Stewart, Kiel Murray, Bob Peterson, Mike Rich","Adventure, Animation, Comedy"
3667,The Good Dinosaur,2015,6.7,133477,1.55,Peter Sohn,"Bob Peterson, Peter Sohn, Erik Benson, Meg LeFauve, Kelsey Mann, Peter Hedges, Adrian Molina","Action, Adventure, Animation"
3668,Tron,1982,6.7,133472,1.6,Steven Lisberger,"Steven Lisberger, Bonnie MacBird","Action, Adventure, Sci-Fi"
3669,Something's Gotta Give,2003,6.7,132762,2.13,Nancy Meyers,Nancy Meyers,"Comedy, Drama, Romance"
3670,The Whole Nine Yards,2000,6.7,132317,1.63,Jonathan Lynn,Mitchell Kapner,"Comedy, Crime"
3671,The Call,2013,6.7,132165,1.57,Brad Anderson,"Richard D'Ovidio, Nicole D'Ovidio, Jon Bokenkamp","Drama, Horror, Thriller"
